chain_rank,source_ref,target_ref,score,max_exact_run_len,max_exact_run,shared_content_token_count,source_text_critical_status,lemma_jaccard,lemma_bigram_dice,lemma_trigram_dice,lemma_lcs_len,lemma_lcs_ratio,lemma_max_exact_run_len,lemma_max_exact_run,lemma_shared_content_token_count,lemma_shared_content_tokens,lemma_score,lemma_minus_surface_score,lemma_retains_or_improves_surface_signal,source_lemma_tokens_content,target_lemma_tokens_content
102,Mark 10:28,Luke 18:28,0.262,2,ιδου ημεισ,3,main_text,0.5714,0.4444,0.2857,4,0.8,3,λεγω πετροσ αφιημι,4,ακολουθεω αφιημι λεγω πετροσ,0.5695,0.3075,True,αρχω λεγω πετροσ αφιημι πασ ακολουθεω,λεγω πετροσ αφιημι ιδιοσ ακολουθεω
103,Mark 10:29,Luke 18:29,0.45,7,αμην λεγω ουδεισ εστιν οσ αφηκεν οικιαν,10,main_text,0.3889,0.3333,0.2727,7,0.5833,5,λεγω ουδεισ ειμι αφιημι οικια,7,αδελφοσ αφιημι ειμι λεγω οικια ουδεισ τεκνον,0.4149,-0.0351,False,φημι ιησουσ λεγω ουδεισ ειμι αφιημι οικια αδελφοσ αδελφη μητηρ πατηρ τεκνον αγροσ ευαγγελιον,λεγω λεγω ουδεισ ειμι αφιημι οικια γυνη αδελφοσ γονευσ τεκνον βασιλεια θεοσ
104,Mark 10:30,Luke 18:30,0.3436,4,αιωνι ερχομενω ζωην αιωνιον,6,main_text,0.3158,0.2609,0.1905,6,0.6667,4,αιων ερχομαι ζωη αιωνιοσ,6,αιων αιωνιοσ ερχομαι ζωη καιροσ μη,0.367,0.0234,True,μη λαμβανω εκατονταπλασιων νυν καιροσ οικια αδελφοσ αδελφη μητηρ τεκνον αγροσ διωγμοσ αιων ερχομαι ζωη αιωνιοσ,ουχι μη απολαμβανω πολλαπλασιων καιροσ αιων ερχομαι ζωη αιωνιοσ
105,Mark 10:33,Luke 18:32,0.2273,2,παραδοθησεται τοισ,3,main_text,0.1429,0.1333,0.0,2,0.4,2,παραδιδωμι εθνοσ,2,εθνοσ παραδιδωμι,0.1793,-0.048,False,οτι αναβαινω ιεροσολυμα υιοσ ανθρωποσ παραδιδωμι αρχιερευσ γραμματευσ κατακρινω θανατοσ παραδιδωμι εθνοσ,παραδιδωμι εθνοσ εμπαιζω υβριζω εμπτυω
106,Mark 10:46,Luke 18:35,0.2653,2,εισ ιεριχω,5,main_text,0.25,0.1053,0.0,4,0.5714,2,καθημαι οδοσ,4,ιεριχω καθημαι οδοσ τυφλοσ,0.264,-0.0013,True,ερχομαι ιεριχω εκπορευομαι ιεριχω μαθητησ οχλοσ ικανοσ υιοσ τιμαιοσ βαρτιμαιοσ τυφλοσ προσαιτησ καθημαι οδοσ,γινομαι εγγιζω ιεριχω τυφλοσ καθημαι οδοσ επαιτεω
107,Mark 10:47,Luke 18:38,0.3131,2,υιε δαυιδ,4,main_text,0.4545,0.1333,0.0,4,0.6667,2,υιοσ δαυιδ,5,δαυιδ ελεαω ιησουσ λεγω υιοσ,0.3892,0.0761,True,ακουω ιησουσ ναζαρηνοσ ειμι αρχω κραζω λεγω υιοσ δαυιδ ιησουσ ελεαω,βοαω λεγω ιησουσ υιοσ δαυιδ ελεαω
108,Mark 10:48,Luke 18:39,0.6293,6,πολλω μαλλον εκραζεν υιε δαυιδ ελεησον,8,main_text,0.7,0.625,0.5714,7,0.7778,6,πολυσ μαλλον κραζω υιοσ δαυιδ ελεαω,7,δαυιδ ελεαω επιτιμαω κραζω μαλλον πολυσ υιοσ,0.6944,0.0651,True,επιτιμαω πολυσ σιωπαω πολυσ μαλλον κραζω υιοσ δαυιδ ελεαω,προαγω επιτιμαω σιγαω πολυσ μαλλον κραζω υιοσ δαυιδ ελεαω
109,Mark 10:51,Luke 18:41,0.3526,2,θελεισ ποιησω,3,main_text,0.4444,0.1667,0.0,4,0.8,2,θελω ποιεω,4,αναβλεπω θελω λεγω ποιεω,0.4178,0.0652,True,αποκρινομαι ιησουσ λεγω θελω ποιεω τυφλοσ λεγω ραββουνι αναβλεπω,θελω ποιεω λεγω κυριοσ αναβλεπω
110,Mark 10:52,Luke 18:42,0.3981,2,ιησουσ αυτω,4,main_text,0.5556,0.3333,0.0,4,0.8,2,ιησουσ λεγω,5,αναβλεπω ιησουσ λεγω πιστισ σωζω,0.4978,0.0997,True,ιησουσ λεγω υπαγω πιστισ σωζω ευθυσ αναβλεπω ακολουθεω οδοσ,ιησουσ λεγω αναβλεπω πιστισ σωζω
111,Mark 11:1,Luke 19:29,0.4515,5,εισ βηθφαγη βηθανιαν προσ οροσ,8,main_text,0.7273,0.5882,0.4,8,0.8889,4,ελαια αποστελλω δυο μαθητησ,8,αποστελλω βηθανια βηθφαγη δυο εγγιζω ελαια μαθητησ οροσ,0.7026,0.2511,True,εγγιζω ιεροσολυμα βηθφαγη βηθανια οροσ ελαια αποστελλω δυο μαθητησ,γινομαι εγγιζω βηθφαγη βηθανια οροσ καλεω ελαια αποστελλω δυο μαθητησ
112,Mark 11:2,Luke 19:30,0.4951,5,ευρησετε πωλον δεδεμενον εφ ουδεισ,12,main_text,0.6471,0.5385,0.3333,11,0.7857,5,εισπορευομαι ευρισκω πωλοσ δεω ουδεισ,11,ανθρωποσ δεω εισπορευομαι ευρισκω καθιζω κωμη λεγω λυω ουδεισ πωλοσ υπαγω,0.6315,0.1364,True,λεγω υπαγω κωμη ευθυσ εισπορευομαι ευρισκω πωλοσ δεω ουδεισ ουπω ανθρωποσ καθιζω λυω φερω,λεγω υπαγω κατεναντι κωμη εισπορευομαι ευρισκω πωλοσ δεω ουδεισ πωποτε ανθρωποσ καθιζω λυω αγω
113,Mark 11:3,Luke 19:34,0.3794,3,κυριοσ χρειαν εχει,3,main_text,0.4444,0.5,0.4,4,1.0,4,λεγω κυριοσ χρεια εχω,4,εχω κυριοσ λεγω χρεια,0.5602,0.1808,True,λεγω ποιεω λεγω κυριοσ χρεια εχω ευθυσ αποστελλω παλιν ωδε,λεγω κυριοσ χρεια εχω
114,Mark 11:7,Luke 19:35,0.1872,1,πωλον,3,main_text,0.3333,0.0,0.0,2,0.3333,1,πωλοσ,3,ιησουσ ιματιον πωλοσ,0.25,0.0628,True,φερω πωλοσ ιησουσ επιβαλλω ιματιον καθιζω,αγω ιησουσ επιριπτω ιματιον πωλοσ επιβιβαζω ιησουσ
115,Mark 11:9,Luke 19:38,0.2244,2,ευλογημενοσ ερχομενοσ,3,main_text,0.3077,0.2667,0.0,4,0.5714,2,ευλογεω ερχομαι,4,ερχομαι ευλογεω κυριοσ ονομα,0.3254,0.101,True,προαγω ακολουθεω κραζω ευλογεω ερχομαι ονομα κυριοσ,λεγω ευλογεω ερχομαι βασιλευσ ονομα κυριοσ ουρανοσ ειρηνη δοξα υψιστοσ
116,Mark 11:13,Luke 19:41,0.1814,2,επ αυτην,3,main_text,0.0625,0.0,0.0,1,0.25,1,οραω,1,οραω,0.0827,-0.0987,False,οραω συκη μακροθεν εχω φυλλον ερχομαι ευρισκω ερχομαι ουδεισ ευρισκω μη φυλλον καιροσ ου ειμι συκον,εγγιζω οραω πολισ κλαιω
117,Mark 11:15,Luke 19:45,0.5513,7,εισελθων εισ ιερον ηρξατο εκβαλλειν τουσ πωλουντασ,7,main_text,0.3846,0.4444,0.375,5,1.0,5,εισερχομαι ιεροσ αρχω εκβαλλω πωλεω,5,αρχω εισερχομαι εκβαλλω ιεροσ πωλεω,0.5173,-0.034,False,ερχομαι ιεροσολυμα εισερχομαι ιεροσ αρχω εκβαλλω πωλεω αγοραζω ιεροσ τραπεζα κολλυβιστησ καθεδρα πωλεω περιστερα καταστρεφω,εισερχομαι ιεροσ αρχω εκβαλλω πωλεω
118,Mark 11:17,Luke 19:46,0.4422,3,οικοσ οικοσ προσευχησ,7,main_text,0.5833,0.5263,0.2353,8,0.8889,3,οικοσ οικοσ προσευχη,7,γραφω λεγω ληστησ οικοσ ποιεω προσευχη σπηλαιον,0.5977,0.1555,True,διδασκω λεγω γραφω οικοσ οικοσ προσευχη καλεω πασ εθνοσ ποιεω σπηλαιον ληστησ,λεγω γραφω ειμι οικοσ οικοσ προσευχη ποιεω σπηλαιον ληστησ
119,Mark 11:18,Luke 19:47,0.203,3,αρχιερεισ γραμματεισ εζητουν,3,main_text,0.2353,0.2105,0.1176,4,0.4,3,αρχιερευσ γραμματευσ ζητεω,4,απολλυμι αρχιερευσ γραμματευσ ζητεω,0.2625,0.0595,True,ακουω αρχιερευσ γραμματευσ ζητεω πωσ απολλυμι φοβεομαι πασ οχλοσ εκπλησσομαι διδαχη,ειμι διδασκω ημερα ιεροσ αρχιερευσ γραμματευσ ζητεω απολλυμι πρωτοσ λαοσ
120,Mark 11:28,Luke 20:2,0.4429,5,ποια εξουσια ταυτα ποιεισ τισ,7,main_text,0.8,0.5,0.2,5,0.8333,3,λεγω εξουσια ποιεω,4,διδωμι εξουσια λεγω ποιεω,0.6807,0.2378,True,λεγω εξουσια ποιεω διδωμι εξουσια ποιεω,λεγω λεγω λεγω εξουσια ποιεω ειμι διδωμι εξουσια
121,Mark 11:30,Luke 20:4,0.8589,4,βαπτισμα ιωαννου ουρανου ανθρωπων,4,main_text,0.8333,0.8889,0.8571,5,1.0,5,βαπτισμα ιωαννησ ουρανοσ ειμι ανθρωποσ,5,ανθρωποσ βαπτισμα ειμι ιωαννησ ουρανοσ,0.8795,0.0206,True,βαπτισμα ιωαννησ ουρανοσ ειμι ανθρωποσ αποκρινομαι,βαπτισμα ιωαννησ ουρανοσ ειμι ανθρωποσ
122,Mark 11:31,Luke 20:5,0.7769,5,ειπωμεν ουρανου ερει επιστευσατε αυτω,8,main_text,0.6667,0.7692,0.7273,6,0.8571,6,λεγω λεγω ουρανοσ λεγω ου πιστευω,4,λεγω ου ουρανοσ πιστευω,0.7438,-0.0331,False,διαλογιζομαι λεγω λεγω λεγω ουρανοσ λεγω ου πιστευω,συλλογιζομαι λεγω λεγω ουρανοσ λεγω ου πιστευω
123,Mark 11:33,Luke 20:8,0.7875,8,ιησουσ αυτοισ ουδε λεγω ποια εξουσια ταυτα ποιω,8,main_text,0.625,0.6667,0.6154,6,1.0,6,ιησουσ λεγω ουδε λεγω εξουσια ποιεω,5,εξουσια ιησουσ λεγω ουδε ποιεω,0.7063,-0.0812,False,αποκρινομαι ιησουσ λεγω ου οιδα ιησουσ λεγω ουδε λεγω εξουσια ποιεω,ιησουσ λεγω ουδε λεγω εξουσια ποιεω
124,Mark 12:1,Luke 20:9,0.282,3,εξεδετο γεωργοισ απεδημησεν,7,main_text,0.4211,0.24,0.087,7,0.5833,3,εκδιδωμι γεωργοσ αποδημεω,8,αμπελων ανθρωποσ αποδημεω αρχω γεωργοσ εκδιδωμι παραβολη φυτευω,0.3921,0.1101,True,αρχω παραβολη λαλεω αμπελων ανθρωποσ φυτευω περιτιθημι φραγμοσ ορυσσω υποληνιον οικοδομεω πυργοσ εκδιδωμι γεωργοσ αποδημεω,αρχω λαοσ λεγω παραβολη ανθρωποσ φυτευω αμπελων εκδιδωμι γεωργοσ αποδημεω χρονοσ ικανοσ
125,Mark 12:2,Luke 20:10,0.4051,4,απεστειλεν προσ τουσ γεωργουσ,7,main_text,0.5455,0.2353,0.0,5,0.625,2,αποστελλω γεωργοσ,6,αμπελων αποστελλω γεωργοσ δουλοσ καιροσ καρποσ,0.4455,0.0404,True,αποστελλω γεωργοσ καιροσ δουλοσ γεωργοσ λαμβανω καρποσ αμπελων,καιροσ αποστελλω γεωργοσ δουλοσ καρποσ αμπελων διδωμι γεωργοσ εξαποστελλω δερω κενοσ
126,Mark 12:6,Luke 20:13,0.1801,2,υιον αγαπητον,3,main_text,0.2857,0.1176,0.0,3,0.3333,2,υιοσ αγαπητοσ,4,αγαπητοσ εντρεπω λεγω υιοσ,0.2466,0.0665,True,ετι εισ εχω υιοσ αγαπητοσ αποστελλω εσχατοσ λεγω εντρεπω υιοσ,λεγω κυριοσ αμπελων ποιεω πεμπω υιοσ αγαπητοσ ισωσ εντρεπω
127,Mark 12:7,Luke 20:14,0.3444,3,ουτοσ εστιν κληρονομοσ,7,main_text,0.6,0.2667,0.1538,6,0.75,3,λεγω ειμι κληρονομοσ,6,αποκτεινω γεωργοσ ειμι κληρονομια κληρονομοσ λεγω,0.5231,0.1787,True,γεωργοσ λεγω ειμι κληρονομοσ δευτε αποκτεινω ειμι κληρονομια,οραω γεωργοσ διαλογιζομαι λεγω ειμι κληρονομοσ αποκτεινω γινομαι κληρονομια
128,Mark 12:8,Luke 20:15,0.2867,2,εξω αμπελωνοσ,3,main_text,0.5,0.25,0.0,2,0.5,2,εκβαλλω αμπελων,3,αμπελων αποκτεινω εκβαλλω,0.405,0.1183,True,λαμβανω αποκτεινω εκβαλλω αμπελων,εκβαλλω αμπελων αποκτεινω ποιεω κυριοσ αμπελων
129,Mark 12:9,Luke 20:16,0.5114,4,ελευσεται απολεσει τουσ γεωργουσ,7,main_text,0.5,0.5882,0.5333,6,0.6667,6,ερχομαι απολλυμι γεωργοσ διδωμι αμπελων αλλοσ,6,αλλοσ αμπελων απολλυμι γεωργοσ διδωμι ερχομαι,0.5632,0.0518,True,ποιεω κυριοσ αμπελων ερχομαι απολλυμι γεωργοσ διδωμι αμπελων αλλοσ,ερχομαι απολλυμι γεωργοσ διδωμι αμπελων αλλοσ ακουω λεγω μη γινομαι
130,Mark 12:10,Luke 20:17,0.5587,8,λιθον απεδοκιμασαν οικοδομουντεσ ουτοσ εγενηθη εισ κεφαλην γωνιασ,8,main_text,0.4615,0.5882,0.5333,6,0.6667,6,λιθοσ αποδοκιμαζω οικοδομεω γινομαι κεφαλη γωνια,6,αποδοκιμαζω γινομαι γωνια κεφαλη λιθοσ οικοδομεω,0.5478,-0.0109,True,ουδε γραφη αναγινωσκω λιθοσ αποδοκιμαζω οικοδομεω γινομαι κεφαλη γωνια,εμβλεπω λεγω ειμι γραφω λιθοσ αποδοκιμαζω οικοδομεω γινομαι κεφαλη γωνια
131,Mark 12:12,Luke 20:19,0.2973,4,εγνωσαν προσ αυτουσ παραβολην,5,main_text,0.3333,0.0,0.0,4,0.4444,1,ζητεω,5,γινωσκω ζητεω λεγω παραβολη φοβεομαι,0.2677,-0.0296,False,ζητεω κρατεω φοβεομαι οχλοσ γινωσκω παραβολη λεγω αφιημι απερχομαι,ζητεω γραμματευσ αρχιερευσ επιβαλλω χειρ ωρα φοβεομαι λαοσ γινωσκω λεγω παραβολη
132,Mark 12:14,Luke 20:21,0.3295,5,αλλ επ αληθειασ οδον διδασκεισ,8,main_text,0.375,0.2703,0.1714,9,0.6429,4,αληθεια οδοσ θεοσ διδασκω,9,αληθεια διδασκαλοσ διδασκω θεοσ λεγω οδοσ οιδα ου προσωπον,0.3906,0.0611,True,ερχομαι λεγω διδασκαλοσ οιδα αληθησ ειμι ου μελει ουδεισ ου βλεπω προσωπον ανθρωποσ αληθεια οδοσ θεοσ διδασκω εξεστιν διδωμι κηνσοσ καισαρ ου διδωμι μη διδωμι,επερωταω λεγω διδασκαλοσ οιδα ορθωσ λεγω διδασκω ου λαμβανω προσωπον αληθεια οδοσ θεοσ διδασκω
133,Mark 12:17,Luke 20:25,0.2758,2,καισαρι θεω,4,main_text,0.6667,0.5,0.2,5,0.8333,3,καισαρ θεοσ θεοσ,4,αποδιδωμι θεοσ καισαρ λεγω,0.614,0.3382,True,ιησουσ λεγω καισαρ αποδιδωμι καισαρ θεοσ θεοσ εκθαυμαζω,λεγω αποδιδωμι καισαρ καισαρ θεοσ θεοσ
134,Mark 12:19,Luke 20:28,0.6186,6,διδασκαλε μωυσησ εγραψεν τινοσ αδελφοσ αποθανη,11,main_text,0.5294,0.6,0.5,12,0.75,6,λαμβανω αδελφοσ γυνη εξανιστημι σπερμα αδελφοσ,9,αδελφοσ αποθνησκω γραφω γυνη διδασκαλοσ εξανιστημι λαμβανω μωυσησ σπερμα,0.599,-0.0196,True,διδασκαλοσ μωυσησ γραφω αδελφοσ αποθνησκω καταλειπω γυνη μη αφιημι τεκνον λαμβανω αδελφοσ γυνη εξανιστημι σπερμα αδελφοσ,λεγω διδασκαλοσ μωυσησ γραφω αδελφοσ αποθνησκω εχω γυνη ατεκνοσ ειμι λαμβανω αδελφοσ γυνη εξανιστημι σπερμα αδελφοσ
135,Mark 12:20,Luke 20:29,0.4402,4,επτα αδελφοι ησαν πρωτοσ,5,main_text,0.6364,0.75,0.7143,7,0.875,7,επτα αδελφοσ ειμι πρωτοσ λαμβανω γυνη αποθνησκω,7,αδελφοσ αποθνησκω γυνη ειμι επτα λαμβανω πρωτοσ,0.7203,0.2801,True,επτα αδελφοσ ειμι πρωτοσ λαμβανω γυνη αποθνησκω ου αφιημι σπερμα,επτα αδελφοσ ειμι πρωτοσ λαμβανω γυνη αποθνησκω ατεκνοσ
136,Mark 12:21,Luke 20:31,0.2592,2,ελαβεν αυτην,4,main_text,0.4167,0.0,0.0,2,0.25,1,λαμβανω,5,αποθνησκω καταλειπω λαμβανω τριτοσ ωσαυτωσ,0.2722,0.013,True,δευτεροσ λαμβανω αποθνησκω μη καταλειπω σπερμα τριτοσ ωσαυτωσ,τριτοσ λαμβανω ωσαυτωσ και επτα ου καταλειπω τεκνον αποθνησκω
137,Mark 12:22,Luke 20:32,0.3507,2,γυνη απεθανεν,2,main_text,0.3,0.3636,0.2222,3,0.75,3,και γυνη αποθνησκω,3,αποθνησκω γυνη και,0.3955,0.0448,True,επτα ου αφιημι σπερμα εσχατοσ πασ και γυνη αποθνησκω,υστεροσ και γυνη αποθνησκω
138,Mark 12:23,Luke 20:33,0.5931,5,γυνη επτα εσχον αυτην γυναικα,7,main_text,0.5,0.4615,0.3636,5,0.7143,4,γυνη επτα εχω γυνη,4,αναστασισ γυνη επτα εχω,0.5267,-0.0664,False,αναστασισ οταν ανιστημι ειμι γυνη επτα εχω γυνη,γυνη αναστασισ γινομαι γυνη επτα εχω γυνη
139,Mark 12:25,Luke 20:35,0.2683,4,ουτε γαμουσιν ουτε γαμιζονται,4,main_text,0.2727,0.1667,0.0,3,0.4286,2,γαμεω γαμιζω,3,γαμεω γαμιζω νεκροσ,0.2677,-0.0006,True,νεκροσ ανιστημι γαμεω γαμιζω ειμι αγγελοσ ουρανοσ,καταξιοω αιων τυγχανω αναστασισ νεκροσ γαμεω γαμιζω
140,Mark 12:26,Luke 20:37,0.1809,1,εγειρονται,5,main_text,0.6,0.4286,0.3077,10,0.7143,6,θεοσ αβρααμ θεοσ ισαακ θεοσ ιακωβ,9,αβρααμ βατοσ εγειρω θεοσ ιακωβ ισαακ λεγω μωυσησ νεκροσ,0.5719,0.391,True,νεκροσ εγειρω ου αναγινωσκω βιβλοσ μωυσησ βατοσ λεγω θεοσ λεγω θεοσ αβρααμ θεοσ ισαακ θεοσ ιακωβ,εγειρω νεκροσ και μωυσησ μηνυω βατοσ λεγω κυριοσ θεοσ αβρααμ θεοσ ισαακ θεοσ ιακωβ
141,Mark 12:27,Luke 20:38,0.4313,3,νεκρων αλλα ζωντων,5,main_text,0.625,0.3333,0.0,4,0.5714,2,ου ειμι,5,ειμι ζαω θεοσ νεκροσ ου,0.4957,0.0644,True,ου ειμι θεοσ νεκροσ ζαω πολυσ πλαναω,θεοσ ου ειμι νεκροσ ζαω πασ ζαω
142,Mark 12:35,Luke 20:41,0.1898,2,πωσ λεγουσιν,3,main_text,0.5455,0.1176,0.0,5,0.7143,2,πωσ λεγω,6,δαυιδ ειμι λεγω πωσ υιοσ χριστοσ,0.4368,0.247,True,αποκρινομαι ιησουσ λεγω διδασκω ιεροσ πωσ λεγω γραμματευσ χριστοσ υιοσ δαυιδ ειμι,λεγω πωσ λεγω χριστοσ ειμι δαυιδ υιοσ
143,Mark 12:36,Luke 20:43,0.4326,4,εωσ θω τουσ εχθρουσ,5,main_text,0.2727,0.1429,0.0,3,0.75,2,τιθημι εχθροσ,3,εχθροσ πουσ τιθημι,0.3148,-0.1178,False,δαυιδ λεγω πνευμα αγιοσ λεγω κυριοσ κυριοσ καθημαι δεξιοσ τιθημι εχθροσ πουσ,τιθημι εχθροσ υποποδιον πουσ
144,Mark 12:37,Luke 20:44,0.2839,2,δαυιδ κυριον,4,main_text,0.3333,0.0,0.0,3,0.5,1,δαυιδ,4,δαυιδ ειμι κυριοσ υιοσ,0.2733,-0.0106,True,δαυιδ λεγω κυριοσ ποθεν ειμι υιοσ πολυσ οχλοσ ακουω ηδεωσ,δαυιδ κυριοσ καλεω πωσ υιοσ ειμι
145,Mark 12:39,Luke 20:46,0.5933,6,πρωτοκαθεδριασ ταισ συναγωγαισ πρωτοκλισιασ τοισ δειπνοισ,6,main_text,0.3333,0.4286,0.3333,4,1.0,4,πρωτοκαθεδρια συναγωγη πρωτοκλισια δειπνον,4,δειπνον πρωτοκαθεδρια πρωτοκλισια συναγωγη,0.4838,-0.1095,False,πρωτοκαθεδρια συναγωγη πρωτοκλισια δειπνον,προσεχω γραμματευσ θελω περιπατεω στολη φιλεω ασπασμοσ αγορα πρωτοκαθεδρια συναγωγη πρωτοκλισια δειπνον
146,Mark 12:40,Luke 20:47,0.6735,5,τασ οικιασ χηρων προφασει μακρα,9,main_text,1.0,1.0,1.0,9,1.0,9,κατεσθιω οικια χηρα προφασισ μακροσ προσευχομαι λαμβανω περισσοτεροσ κριμα,9,κατεσθιω κριμα λαμβανω μακροσ οικια περισσοτεροσ προσευχομαι προφασισ χηρα,1.0,0.3265,True,κατεσθιω οικια χηρα προφασισ μακροσ προσευχομαι λαμβανω περισσοτεροσ κριμα,κατεσθιω οικια χηρα προφασισ μακροσ προσευχομαι λαμβανω περισσοτεροσ κριμα
147,Mark 12:43,Luke 21:3,0.5052,5,λεγω χηρα πτωχη πλειον εβαλεν,5,main_text,0.6,0.5882,0.5333,7,0.875,6,λεγω χηρα πτωχοσ πολυσ πασ βαλλω,6,βαλλω λεγω πασ πολυσ πτωχοσ χηρα,0.6515,0.1463,True,προσκαλεομαι μαθητησ λεγω λεγω χηρα πτωχοσ πολυσ πασ βαλλω βαλλω γαζοφυλακιον,λεγω αληθωσ λεγω χηρα πτωχοσ πολυσ πασ βαλλω
148,Mark 12:44,Luke 21:4,0.3993,3,περισσευοντοσ αυτοισ εβαλον,8,main_text,0.5556,0.375,0.1429,6,0.6667,3,πασ περισσευω βαλλω,5,βαλλω βιοσ εχω πασ περισσευω,0.5116,0.1123,True,πασ περισσευω βαλλω υστερησισ πασ εχω βαλλω ολοσ βιοσ,πασ περισσευω βαλλω δωρον υστερημα πασ βιοσ εχω βαλλω
149,Mark 13:4,Luke 21:7,0.67,7,ποτε ταυτα εσται σημειον οταν μελλη ταυτα,6,main_text,0.5,0.4615,0.3636,5,0.7143,4,ποτε ειμι σημειον μελλω,5,ειμι λεγω μελλω ποτε σημειον,0.5321,-0.1379,False,λεγω ποτε ειμι σημειον μελλω συντελεω πασ,επερωταω λεγω διδασκαλοσ ποτε ειμι σημειον μελλω γινομαι
150,Mark 13:6,Luke 21:8,0.4912,5,πολλοι ελευσονται ονοματι λεγοντεσ ειμι,5,main_text,0.5455,0.4706,0.4,5,0.7143,5,πολυσ ερχομαι ονομα λεγω ειμι,6,ειμι ερχομαι λεγω ονομα πλαναω πολυσ,0.5483,0.0571,True,πολυσ ερχομαι ονομα λεγω ειμι πολυσ πλαναω,λεγω βλεπω πλαναω πολυσ ερχομαι ονομα λεγω ειμι καιροσ εγγιζω μη πορευομαι
151,Mark 13:7,Luke 21:9,0.3713,3,οταν ακουσητε πολεμουσ,7,main_text,0.4286,0.2105,0.0,6,0.6,2,ακουω πολεμοσ,6,ακουω γινομαι δεω μη πολεμοσ τελοσ,0.3839,0.0126,True,ακουω πολεμοσ ακοη πολεμοσ μη θροεομαι δεω γινομαι ουπω τελοσ,ακουω πολεμοσ ακαταστασια μη πτοεομαι δεω γινομαι πρωτοσ ου ευθεωσ τελοσ
152,Mark 13:8,Luke 21:10,0.5385,6,εγερθησεται εθνοσ επ εθνοσ βασιλεια βασιλειαν,5,main_text,0.2727,0.4706,0.4,5,0.7143,5,εγειρω εθνοσ εθνοσ βασιλεια βασιλεια,3,βασιλεια εγειρω εθνοσ,0.418,-0.1205,False,εγειρω εθνοσ εθνοσ βασιλεια βασιλεια ειμι σεισμοσ τοποσ ειμι λιμοσ αρχη ωδιν,τοτε λεγω εγειρω εθνοσ εθνοσ βασιλεια βασιλεια
153,Mark 13:9,Luke 21:13,0.2391,2,εισ μαρτυριον,2,main_text,0.1,0.0,0.0,1,0.5,1,μαρτυριον,1,μαρτυριον,0.1511,-0.088,False,βλεπω παραδιδωμι συνεδριον συναγωγη δερω ηγεμων βασιλευσ ιστημι μαρτυριον,αποβαινω μαρτυριον
