matt_ref	luke_ref	score	pair_classes	lemma_insertions	lemma_deletions	lemma_replacements	inserted_lemmas	deleted_lemmas	moved_lemmas	matt_text	luke_text
Matt 13:23	Luke 8:15	0.24458	matt_expands;substitution	6	13	5	ἐν;καρδία;καλός;καί;ἀγαθός;ἀκούω	σπείρω;συνίημι;ὅς;δή;ὅς;μέν;ἑκατόν;ὅς;δέ;ἑξήκοντα;ὅς;δέ;τριάκοντα	λόγος;καρποφορέω;ἀκούω	ὁ δὲ ἐπὶ τὴν ⸂καλὴν γῆν⸃ σπαρείς, οὗτός ἐστιν ὁ τὸν λόγον ἀκούων καὶ ⸀συνιείς, ὃς δὴ καρποφορεῖ καὶ ποιεῖ ὃ μὲν ἑκατὸν ὃ δὲ ἑξήκοντα ὃ δὲ τριάκοντα.	τὸ δὲ ἐν τῇ καλῇ γῇ, οὗτοί εἰσιν οἵτινες ἐν καρδίᾳ καλῇ καὶ ἀγαθῇ ἀκούσαντες τὸν λόγον κατέχουσιν καὶ καρποφοροῦσιν ἐν ὑπομονῇ.
Matt 13:37	Luke 8:21	0.121777	luke_expands;substitution	8	1	6	ἀδελφός;ἐγώ;οὗτος;ὁ;θεός;ἀκούω;καί;ποιέω	υἱός	εἰμί	ὁ δὲ ἀποκριθεὶς ⸀εἶπεν· Ὁ σπείρων τὸ καλὸν σπέρμα ἐστὶν ὁ υἱὸς τοῦ ἀνθρώπου·	ὁ δὲ ἀποκριθεὶς εἶπεν πρὸς αὐτούς· Μήτηρ μου καὶ ἀδελφοί μου οὗτοί εἰσιν οἱ τὸν λόγον τοῦ θεοῦ ἀκούοντες καὶ ⸀ποιοῦντες.
Matt 13:51	Luke 8:45	0.131545	luke_expands;substitution	15	0	4	ὁ;Ἰησοῦς;τίς;ὁ;ἅπτω;ἐγώ;ἀρνέομαι;δέ;ἐπιστάτης;ὁ;ὄχλος;συνέχω;σύ;καί;ἀποθλίβω		πᾶς;λέγω	⸀Συνήκατε ταῦτα πάντα; λέγουσιν αὐτῷ· ⸀Ναί.	καὶ εἶπεν ὁ Ἰησοῦς· Τίς ὁ ἁψάμενός μου; ἀρνουμένων δὲ πάντων εἶπεν ὁ ⸀Πέτρος· Ἐπιστάτα, οἱ ὄχλοι συνέχουσίν σε καὶ ⸀ἀποθλίβουσιν.
Matt 14:1	Luke 9:7	0.295498	luke_expands	13	4	2	δέ;καί;διαπορέω;διά;ὁ;λέγω;ὑπό;τις;ὅτι;Ἰωάννης;ἐγείρω;ἐκ;νεκρός	ἐν;ἐκεῖνος;ὁ;καιρός	ἀκούω;τετραάρχης;Ἡρῴδης	Ἐν ἐκείνῳ τῷ καιρῷ ἤκουσεν Ἡρῴδης ὁ τετραάρχης τὴν ἀκοὴν Ἰησοῦ,	Ἤκουσεν δὲ Ἡρῴδης ὁ τετραάρχης τὰ ⸀γινόμενα πάντα, καὶ διηπόρει διὰ τὸ λέγεσθαι ὑπό τινων ὅτι Ἰωάννης ⸀ἠγέρθη ἐκ νεκρῶν,
Matt 14:10	Luke 9:9	0.141019	luke_expands;substitution;reordering	15	4	3	λέγω;δέ;ὁ;Ἡρῴδης;Ἰωάννης;ἐγώ;ἀποκεφαλίζω;τίς;δέ;εἰμί;οὗτος;περί;ὅς;ἀκούω;τοιοῦτος	Ἰωάννης;ἐν;ὁ;φυλακή	καί;ἀποκεφαλίζω	καὶ πέμψας ἀπεκεφάλισεν ⸀τὸν Ἰωάννην ἐν τῇ φυλακῇ·	⸂εἶπεν δὲ⸃ ⸀ὁ Ἡρῴδης· Ἰωάννην ἐγὼ ἀπεκεφάλισα· τίς δέ ἐστιν οὗτος περὶ ⸀οὗ ἀκούω τοιαῦτα; καὶ ἐζήτει ἰδεῖν αὐτόν.
Matt 14:15	Luke 9:12	0.157543	luke_expands;reordering	16	12	6	ἄρχω;κλίνω;δέ;ὁ;δώδεκα;λέγω;κύκλῳ;καί;εὑρίσκω;ἐπισιτισμός;ὅτι;ὧδε;ἐν;ἔρημος;τόπος;εἰμί	ὁ;μαθητής;λέγω;ἔρημος;εἰμί;ὁ;τόπος;καί;ὁ;ὥρα;ἤδη;παρέρχομαι	εἰμί;ἔρημος;τόπος;καί;αὐτός;εἰς;ἀπολύω;ἵνα;ὄχλος;κώμη;ὁ;λέγω;προσέρχομαι	ὀψίας δὲ γενομένης προσῆλθον αὐτῷ οἱ ⸀μαθηταὶ λέγοντες· Ἔρημός ἐστιν ὁ τόπος καὶ ἡ ὥρα ἤδη παρῆλθεν· ἀπόλυσον τοὺς ὄχλους, ἵνα ἀπελθόντες εἰς τὰς κώμας ἀγοράσωσιν ἑαυτοῖς βρώματα.	Ἡ δὲ ἡμέρα ἤρξατο κλίνειν· προσελθόντες δὲ οἱ δώδεκα εἶπαν αὐτῷ· Ἀπόλυσον τὸν ὄχλον, ἵνα ⸀πορευθέντες εἰς τὰς κύκλῳ κώμας ⸀καὶ ἀγροὺς καταλύσωσιν καὶ εὕρωσιν ἐπισιτισμόν, ὅτι ὧδε ἐν ἐρήμῳ τόπῳ ἐσμέν.
Matt 14:16	Luke 9:13	0.1774	luke_expands;reordering	24	5	2	ὁ;δέ;λέγω;οὐ;εἰμί;ἐγώ;πολύς;ἤ;ἄρτος;πέντε;καί;ἰχθύς;δύο;εἰ;μήτι;πορεύομαι;ἐγώ;ἀγοράζω;εἰς;πᾶς;ὁ;λαός;οὗτος;βρῶμα	λέγω;οὐ;χρεία;ἔχω;ἀπέρχομαι	ὁ;οὐ;δίδωμι;σύ;ἐσθίω;λέγω	ὁ δὲ Ἰησοῦς εἶπεν αὐτοῖς· Οὐ χρείαν ἔχουσιν ἀπελθεῖν· δότε αὐτοῖς ὑμεῖς φαγεῖν.	εἶπεν δὲ πρὸς αὐτούς· Δότε αὐτοῖς ⸂ὑμεῖς φαγεῖν⸃. οἱ δὲ εἶπαν· Οὐκ εἰσὶν ἡμῖν πλεῖον ἢ ⸂ἄρτοι πέντε⸃ καὶ ἰχθύες δύο, εἰ μήτι πορευθέντες ἡμεῖς ἀγοράσωμεν εἰς πάντα τὸν λαὸν τοῦτον βρώματα.
Matt 14:19	Luke 9:16	0.573559	matt_expands	3	12	2	δέ;αὐτός;καί	καί;κελεύω;ὁ;ὄχλος;ἀνακλίνω;ἐπί;ὁ;χόρτος;ἄρτος;ὁ;δέ;μαθητής	δέ;ὄχλος;λαμβάνω;δύο;εἰς;εὐλογέω;οὐρανός;πέντε;ἀναβλέπω;ἄρτος;ἰχθύς;δίδωμι;καί;μαθητής	καὶ κελεύσας τοὺς ὄχλους ἀνακλιθῆναι ἐπὶ ⸂τοῦ χόρτου⸃, λαβὼν τοὺς πέντε ἄρτους καὶ τοὺς δύο ἰχθύας, ἀναβλέψας εἰς τὸν οὐρανὸν εὐλόγησεν καὶ κλάσας ἔδωκεν τοῖς μαθηταῖς τοὺς ἄρτους οἱ δὲ μαθηταὶ τοῖς ὄχλοις.	λαβὼν δὲ τοὺς πέντε ἄρτους καὶ τοὺς δύο ἰχθύας ἀναβλέψας εἰς τὸν οὐρανὸν εὐλόγησεν αὐτοὺς καὶ κατέκλασεν καὶ ἐδίδου τοῖς μαθηταῖς ⸀παραθεῖναι τῷ ὄχλῳ.
Matt 14:20	Luke 9:17	0.531117	partial_overlap	2	3	1	πᾶς;κόφινος	πᾶς;κόφινος;πλήρης	πᾶς	καὶ ἔφαγον πάντες καὶ ἐχορτάσθησαν, καὶ ἦραν τὸ περισσεῦον τῶν κλασμάτων δώδεκα κοφίνους πλήρεις.	καὶ ἔφαγον καὶ ἐχορτάσθησαν πάντες, καὶ ἤρθη τὸ περισσεῦσαν αὐτοῖς κλασμάτων κόφινοι δώδεκα.
Matt 15:10	Luke 9:18	0.132575	luke_expands;reordering	17	3	2	ἐν;ὁ;εἰμί;αὐτός;προσεύχομαι;κατά;μόνος;σύνειμι;αὐτός;ὁ;μαθητής;καί;ἐπερωτάω;αὐτός;λέγω;τίς;ἐγώ	ἀκούω;καί;συνίημι	ὄχλος;λέγω	Καὶ προσκαλεσάμενος τὸν ὄχλον εἶπεν αὐτοῖς· Ἀκούετε καὶ συνίετε·	Καὶ ἐγένετο ἐν τῷ εἶναι αὐτὸν προσευχόμενον κατὰ μόνας συνῆσαν αὐτῷ οἱ μαθηταί, καὶ ἐπηρώτησεν αὐτοὺς λέγων· Τίνα με ⸂οἱ ὄχλοι λέγουσιν⸃ εἶναι;
Matt 16:14	Luke 9:19	0.386177	substitution	2	2	5	ἀποκρίνομαι;ἀνίστημι	ὁ;μέν	προφήτης	οἱ δὲ εἶπαν· Οἱ μὲν Ἰωάννην τὸν βαπτιστήν, ἄλλοι δὲ Ἠλίαν, ἕτεροι δὲ Ἰερεμίαν ἢ ἕνα τῶν προφητῶν.	οἱ δὲ ἀποκριθέντες εἶπαν· Ἰωάννην τὸν βαπτιστήν, ἄλλοι δὲ Ἠλίαν, ἄλλοι δὲ ὅτι προφήτης τις τῶν ἀρχαίων ἀνέστη.
Matt 16:15	Luke 9:20	0.578871	luke_expands	9	0	0	δέ;Πέτρος;δέ;ἀποκρίνομαι;λέγω;ὁ;Χριστός;ὁ;θεός		δέ	λέγει αὐτοῖς· Ὑμεῖς δὲ τίνα με λέγετε εἶναι;	εἶπεν δὲ αὐτοῖς· Ὑμεῖς δὲ τίνα με λέγετε εἶναι; ⸂Πέτρος δὲ ἀποκριθεὶς⸃ εἶπεν· Τὸν χριστὸν τοῦ θεοῦ.
Matt 16:20	Luke 9:21	0.204756	matt_expands;substitution;reordering	2	6	3	αὐτός;παραγγέλλω	τότε;διαστέλλομαι;αὐτός;εἰμί;ὁ;Χριστός	αὐτός;ὁ	τότε ⸀διεστείλατο τοῖς ⸀μαθηταῖς ἵνα μηδενὶ εἴπωσιν ὅτι αὐτός ⸀ἐστιν ὁ χριστός.	Ὁ δὲ ἐπιτιμήσας αὐτοῖς παρήγγειλεν μηδενὶ ⸀λέγειν τοῦτο,
Matt 16:21	Luke 9:22	0.549462	matt_expands	2	9	5	καί;ἀποδοκιμάζω	τότε;ἄρχω;ὁ;Ἰησοῦς;δείκνυμι;ὁ;μαθητής;αὐτός;καί	ἀπό;πάσχω;πολύς;δέω;ὅτι;γραμματεύς;πρεσβύτερος;τρίτος;ἀποκτείνω;ἀρχιερεύς;ἐγείρω;ἡμέρα;καί	Ἀπὸ τότε ἤρξατο ⸂ὁ Ἰησοῦς⸃ δεικνύειν τοῖς μαθηταῖς αὐτοῦ ὅτι δεῖ αὐτὸν ⸂εἰς Ἱεροσόλυμα ἀπελθεῖν⸃ καὶ πολλὰ παθεῖν ἀπὸ τῶν πρεσβυτέρων καὶ ἀρχιερέων καὶ γραμματέων καὶ ἀποκτανθῆναι καὶ τῇ τρίτῃ ἡμέρᾳ ἐγερθῆναι.	εἰπὼν ὅτι Δεῖ τὸν υἱὸν τοῦ ἀνθρώπου πολλὰ παθεῖν καὶ ἀποδοκιμασθῆναι ἀπὸ τῶν πρεσβυτέρων καὶ ἀρχιερέων καὶ γραμματέων καὶ ἀποκτανθῆναι καὶ τῇ τρίτῃ ἡμέρᾳ ⸀ἐγερθῆναι.
Matt 16:24	Luke 9:23	0.478535	partial_overlap	2	3	4	κατά;ἡμέρα	τότε;ὁ;Ἰησοῦς	ὁ;αὐτός;αἴρω;εἰ;θέλω;καί;λέγω;σταυρός;τις;ἐγώ;ἑαυτοῦ;ἔρχομαι;ὀπίσω	Τότε ὁ Ἰησοῦς εἶπεν τοῖς μαθηταῖς αὐτοῦ· Εἴ τις θέλει ὀπίσω μου ἐλθεῖν, ἀπαρνησάσθω ἑαυτὸν καὶ ἀράτω τὸν σταυρὸν αὐτοῦ καὶ ἀκολουθείτω μοι.	Ἔλεγεν δὲ πρὸς πάντας· Εἴ τις θέλει ὀπίσω μου ⸂ἔρχεσθαι, ἀρνησάσθω⸃ ἑαυτὸν καὶ ἀράτω τὸν σταυρὸν αὐτοῦ ⸂καθ’ ἡμέραν⸃, καὶ ἀκολουθείτω μοι.
Matt 16:25	Luke 9:24	0.831073	partial_overlap	1	0	2	σῴζω		ἄν	ὃς γὰρ ⸀ἐὰν θέλῃ τὴν ψυχὴν αὐτοῦ σῶσαι ἀπολέσει αὐτήν· ὃς δ’ ἂν ἀπολέσῃ τὴν ψυχὴν αὐτοῦ ἕνεκεν ἐμοῦ εὑρήσει αὐτήν.	ὃς γὰρ ⸀ἂν θέλῃ τὴν ψυχὴν αὐτοῦ σῶσαι, ἀπολέσει αὐτήν· ὃς δ’ ἂν ἀπολέσῃ τὴν ψυχὴν αὐτοῦ ἕνεκεν ἐμοῦ, οὗτος σώσει αὐτήν.
Matt 16:26	Luke 9:25	0.46549	matt_expands;substitution	0	9	4		ὁ;ἤ;τίς;δίδωμι;ἄνθρωπος;ἀντάλλαγμα;ὁ;ψυχή;αὐτός	κερδαίνω;ἤ	τί γὰρ ⸀ὠφεληθήσεται ἄνθρωπος ἐὰν τὸν κόσμον ὅλον κερδήσῃ τὴν δὲ ψυχὴν αὐτοῦ ζημιωθῇ; ἢ τί δώσει ἄνθρωπος ἀντάλλαγμα τῆς ψυχῆς αὐτοῦ;	τί γὰρ ὠφελεῖται ἄνθρωπος κερδήσας τὸν κόσμον ὅλον ἑαυτὸν δὲ ἀπολέσας ἢ ζημιωθείς;
Matt 16:27	Luke 9:26	0.255779	luke_expands	13	10	2	ἄν;ἐπαισχύνομαι;ἐγώ;καί;ὁ;ἐμός;λόγος;οὗτος;ἐπαισχύνομαι;ὅταν;αὐτός;καί;ἅγιος	μετά;αὐτός;καί;τότε;ἀποδίδωμι;ἕκαστος;κατά;ὁ;πρᾶξις;αὐτός	καί;πατήρ;ἄγγελος;δόξα;ἐν;ἔρχομαι;αὐτός;υἱός;ἄνθρωπος;ὁ	μέλλει γὰρ ὁ υἱὸς τοῦ ἀνθρώπου ἔρχεσθαι ἐν τῇ δόξῃ τοῦ πατρὸς αὐτοῦ μετὰ τῶν ἀγγέλων αὐτοῦ, καὶ τότε ἀποδώσει ἑκάστῳ κατὰ τὴν πρᾶξιν αὐτοῦ.	ὃς γὰρ ἂν ἐπαισχυνθῇ με καὶ τοὺς ἐμοὺς λόγους, τοῦτον ὁ υἱὸς τοῦ ἀνθρώπου ἐπαισχυνθήσεται, ὅταν ἔλθῃ ἐν τῇ δόξῃ αὐτοῦ καὶ τοῦ πατρὸς καὶ τῶν ἁγίων ἀγγέλων.
Matt 16:28	Luke 9:27	0.536718	matt_expands;substitution	1	6	5	δέ	ἀμήν;ἔρχομαι;ἐν;ὁ;βασιλεία;αὐτός	βασιλεία	ἀμὴν λέγω ὑμῖν ⸀ὅτι εἰσίν τινες ⸂τῶν ὧδε ἑστώτων⸃ οἵτινες οὐ μὴ γεύσωνται θανάτου ἕως ἂν ἴδωσιν τὸν υἱὸν τοῦ ἀνθρώπου ἐρχόμενον ἐν τῇ βασιλείᾳ αὐτοῦ.	λέγω δὲ ὑμῖν ἀληθῶς, εἰσίν τινες τῶν ⸀αὐτοῦ ⸀ἑστηκότων οἳ οὐ μὴ γεύσωνται θανάτου ἕως ἂν ἴδωσιν τὴν βασιλείαν τοῦ θεοῦ.
Matt 17:1	Luke 9:28	0.175104	matt_expands;reordering	11	14	3	γίνομαι;δέ;μετά;ὁ;λόγος;οὗτος;ὡσεί;ἡμέρα;ὀκτώ;Ἰωάννης;καί	μετά;ἡμέρα;ἕξ;ὁ;Ἰησοῦς;ὁ;ἀδελφός;αὐτός;καί;ἀναφέρω;αὐτός;εἰς;κατά;ἴδιος	καί;παραλαμβάνω;ἡμέρα;Ἰάκωβος;Πέτρος;εἰς;ὁ	Καὶ μεθ’ ἡμέρας ἓξ παραλαμβάνει ὁ Ἰησοῦς τὸν Πέτρον καὶ Ἰάκωβον καὶ Ἰωάννην τὸν ἀδελφὸν αὐτοῦ, καὶ ἀναφέρει αὐτοὺς εἰς ὄρος ὑψηλὸν κατ’ ἰδίαν.	Ἐγένετο δὲ μετὰ τοὺς λόγους τούτους ὡσεὶ ἡμέραι ὀκτὼ ⸀καὶ παραλαβὼν Πέτρον καὶ Ἰωάννην καὶ Ἰάκωβον ἀνέβη εἰς τὸ ὄρος προσεύξασθαι.
Matt 17:2	Luke 9:29	0.1336	matt_expands;substitution;reordering	3	6	7	ὁ;προσεύχομαι;καί	ὁ;δέ;ἱμάτιον;γίνομαι;ὁ;φῶς	γίνομαι;ὁ;αὐτός;πρόσωπον	καὶ μετεμορφώθη ἔμπροσθεν αὐτῶν, καὶ ἔλαμψεν τὸ πρόσωπον αὐτοῦ ὡς ὁ ἥλιος, τὰ δὲ ἱμάτια αὐτοῦ ⸀ἐγένετο λευκὰ ὡς τὸ φῶς.	καὶ ἐγένετο ἐν τῷ προσεύχεσθαι αὐτὸν τὸ εἶδος τοῦ προσώπου αὐτοῦ ἕτερον καὶ ὁ ἱματισμὸς αὐτοῦ λευκὸς ἐξαστράπτων.
Matt 17:3	Luke 9:30	0.435008	partial_overlap	4	3	1	δύο;συλλαλέω;ὅστις;εἰμί	συλλαλέω;μετά;αὐτός	Μωϋσῆς;Ἠλίας;συλλαλέω;αὐτός	καὶ ἰδοὺ ⸀ὤφθη αὐτοῖς Μωϋσῆς καὶ Ἠλίας ⸂συλλαλοῦντες μετ’ αὐτοῦ⸃.	καὶ ἰδοὺ ἄνδρες δύο συνελάλουν αὐτῷ, οἵτινες ἦσαν Μωϋσῆς καὶ Ἠλίας,
Matt 17:4	Luke 9:33	0.44851	luke_expands;substitution	12	3	8	ἐν;ὁ;διαχωρίζομαι;αὐτός;ἀπό;αὐτός;λέγω;καί;Μωϋσῆς;ὁράω;ὅς;λέγω	θέλω;Μωϋσῆς;καί	καί;Πέτρος;εἰμί;καλός;ἐγώ;Ἰησοῦς;ὧδε;Μωϋσῆς;ποιέω;σύ;τρεῖς;Ἠλίας;εἷς;λέγω;σκηνή	ἀποκριθεὶς δὲ ὁ Πέτρος εἶπεν τῷ Ἰησοῦ· Κύριε, καλόν ἐστιν ἡμᾶς ὧδε εἶναι· εἰ θέλεις, ⸀ποιήσω ὧδε τρεῖς σκηνάς, σοὶ μίαν καὶ Μωϋσεῖ μίαν καὶ ⸂Ἠλίᾳ μίαν⸃.	καὶ ἐγένετο ἐν τῷ διαχωρίζεσθαι αὐτοὺς ἀπ’ αὐτοῦ εἶπεν ⸀ὁ Πέτρος πρὸς τὸν Ἰησοῦν· Ἐπιστάτα, καλόν ἐστιν ἡμᾶς ὧδε εἶναι, καὶ ποιήσωμεν σκηνὰς τρεῖς, μίαν σοὶ καὶ μίαν Μωϋσεῖ καὶ μίαν Ἠλίᾳ, μὴ εἰδὼς ὃ λέγει.
Matt 17:5	Luke 9:35	0.378496	matt_expands	1	12	2	γίνομαι	ἔτι;αὐτός;λαλέω;ἰδού;νεφέλη;φωτεινός;ἐπισκιάζω;αὐτός;ἰδού;ὅς;εὐδοκέω;αὐτός	αὐτός;ἀκούω;φωνή;εἰμί;καί;λέγω;οὗτος;υἱός;ἐγώ;ἐκ;ὁ	ἔτι αὐτοῦ λαλοῦντος ἰδοὺ νεφέλη φωτεινὴ ἐπεσκίασεν αὐτούς, καὶ ἰδοὺ φωνὴ ἐκ τῆς νεφέλης λέγουσα· Οὗτός ἐστιν ὁ υἱός μου ὁ ἀγαπητός, ἐν ᾧ εὐδόκησα· ⸂ἀκούετε αὐτοῦ⸃.	καὶ φωνὴ ἐγένετο ἐκ τῆς νεφέλης λέγουσα· Οὗτός ἐστιν ὁ υἱός μου ὁ ⸀ἐκλελεγμένος, αὐτοῦ ἀκούετε.
Matt 17:8	Luke 9:36	0.264173	luke_expands;substitution;reordering	13	3	6	καί;αὐτός;σιγάω;καί;οὐδείς;ἀπαγγέλλω;ἐν;ἐκεῖνος;ὁ;ἡμέρα;οὐδείς;ὅς;ὁράω	εἰ;μή;αὐτός	ὁράω;οὐδείς;αὐτός;μόνος;Ἰησοῦς	ἐπάραντες δὲ τοὺς ὀφθαλμοὺς αὐτῶν οὐδένα εἶδον εἰ μὴ ⸀αὐτὸν Ἰησοῦν μόνον.	καὶ ἐν τῷ γενέσθαι τὴν φωνὴν ⸀εὑρέθη Ἰησοῦς μόνος. καὶ αὐτοὶ ἐσίγησαν καὶ οὐδενὶ ἀπήγγειλαν ἐν ἐκείναις ταῖς ἡμέραις οὐδὲν ὧν ἑώρακαν.
Matt 17:16	Luke 9:40	0.276857	partial_overlap	3	3	1	ἵνα;ἐκβάλλω;αὐτός	αὐτός;αὐτός;θεραπεύω	αὐτός;δύναμαι;οὐ	καὶ προσήνεγκα αὐτὸν τοῖς μαθηταῖς σου, καὶ οὐκ ἠδυνήθησαν αὐτὸν θεραπεῦσαι.	καὶ ἐδεήθην τῶν μαθητῶν σου ἵνα ἐκβάλωσιν αὐτό, καὶ οὐκ ἠδυνήθησαν.
Matt 17:17	Luke 9:41	0.657006	partial_overlap	4	4	3	πρός;ὁ;υἱός;σύ	ἕως;πότε;ἐγώ;αὐτός	ὧδε;εἰμί	ἀποκριθεὶς δὲ ὁ Ἰησοῦς εἶπεν· Ὦ γενεὰ ἄπιστος καὶ διεστραμμένη, ἕως πότε ⸂μεθ’ ὑμῶν ἔσομαι⸃; ἕως πότε ἀνέξομαι ὑμῶν; φέρετέ μοι αὐτὸν ὧδε.	ἀποκριθεὶς δὲ ὁ Ἰησοῦς εἶπεν· Ὦ γενεὰ ἄπιστος καὶ διεστραμμένη, ἕως πότε ἔσομαι πρὸς ὑμᾶς καὶ ἀνέξομαι ὑμῶν; προσάγαγε ⸂ὧδε τὸν υἱόν σου⸃.
Matt 17:18	Luke 9:42	0.213542	luke_expands;substitution;reordering	13	4	7	προσέρχομαι;ἐπιτιμάω;δέ;ὁ;Ἰησοῦς;ὁ;πνεῦμα;ὁ;ἀκάθαρτος;καί;ἰάομαι;ἀποδίδωμι;αὐτός	Ἰησοῦς;καί;ἐξέρχομαι;ἀπό	ἐπιτιμάω;Ἰησοῦς;καί;παῖς;δαιμόνιον;ὁ	καὶ ἐπετίμησεν αὐτῷ ὁ Ἰησοῦς, καὶ ἐξῆλθεν ἀπ’ αὐτοῦ τὸ δαιμόνιον· καὶ ἐθεραπεύθη ὁ παῖς ἀπὸ τῆς ὥρας ἐκείνης.	ἔτι δὲ προσερχομένου αὐτοῦ ἔρρηξεν αὐτὸν τὸ δαιμόνιον καὶ συνεσπάραξεν· ἐπετίμησεν δὲ ὁ Ἰησοῦς τῷ πνεύματι τῷ ἀκαθάρτῳ, καὶ ἰάσατο τὸν παῖδα καὶ ἀπέδωκεν αὐτὸν τῷ πατρὶ αὐτοῦ.
Matt 17:22	Luke 9:44	0.377105	substitution	2	2	7	γάρ;μέλλω	ἐν;αὐτός	εἰς;μέλλω	⸀Συστρεφομένων δὲ αὐτῶν ἐν τῇ Γαλιλαίᾳ εἶπεν αὐτοῖς ὁ Ἰησοῦς· Μέλλει ὁ υἱὸς τοῦ ἀνθρώπου παραδίδοσθαι εἰς χεῖρας ἀνθρώπων,	Θέσθε ὑμεῖς εἰς τὰ ὦτα ὑμῶν τοὺς λόγους τούτους, ὁ γὰρ υἱὸς τοῦ ἀνθρώπου μέλλει παραδίδοσθαι εἰς χεῖρας ἀνθρώπων.
Matt 18:2	Luke 9:47	0.266688	luke_expands;substitution;reordering	8	1	4	Ἰησοῦς;ὁράω;ὁ;διαλογισμός;ὁ;καρδία;αὐτός;ἐπιλαμβάνομαι	αὐτός	παιδίον;ἵστημι;αὐτός	καὶ ⸀προσκαλεσάμενος παιδίον ἔστησεν αὐτὸ ἐν μέσῳ αὐτῶν	ὁ δὲ Ἰησοῦς ⸀εἰδὼς τὸν διαλογισμὸν τῆς καρδίας αὐτῶν ἐπιλαβόμενος ⸀παιδίον ἔστησεν αὐτὸ παρ’ ἑαυτῷ,
Matt 18:5	Luke 9:48	0.404448	luke_expands	22	1	2	λέγω;αὐτός;ὁ;καί;ὅς;ἄν;ἐγώ;δέχομαι;δέχομαι;ὁ;ἀποστέλλω;ἐγώ;ὁ;γάρ;μικρός;ἐν;πᾶς;σύ;ὑπάρχω;οὗτος;εἰμί;μέγας	τοιοῦτος	παιδίον;δέχομαι;ἐγώ;ἐπί;ὄνομα;ὅς	καὶ ὃς ⸀ἐὰν δέξηται ⸂ἓν παιδίον τοιοῦτο⸃ ἐπὶ τῷ ὀνόματί μου, ἐμὲ δέχεται.	καὶ εἶπεν αὐτοῖς· Ὃς ⸀ἂν δέξηται τοῦτο τὸ παιδίον ἐπὶ τῷ ὀνόματί μου ἐμὲ δέχεται, καὶ ὃς ⸁ἂν ἐμὲ δέξηται δέχεται τὸν ἀποστείλαντά με· ὁ γὰρ μικρότερος ἐν πᾶσιν ὑμῖν ὑπάρχων οὗτός ⸀ἐστιν μέγας.
Matt 18:10	Luke 15:3	0.115136	matt_expands;substitution;reordering	0	19	5		γάρ;σύ;ὅτι;ὁ;ἄγγελος;αὐτός;ἐν;οὐρανός;διά;πᾶς;βλέπω;ὁ;πρόσωπον;ὁ;πατήρ;ἐγώ;ὁ;ἐν;οὐρανός	αὐτός;λέγω	Ὁρᾶτε μὴ καταφρονήσητε ἑνὸς τῶν μικρῶν τούτων, λέγω γὰρ ὑμῖν ὅτι οἱ ἄγγελοι αὐτῶν ἐν οὐρανοῖς διὰ παντὸς βλέπουσι τὸ πρόσωπον τοῦ πατρός μου τοῦ ἐν ⸀οὐρανοῖς.	εἶπεν δὲ πρὸς αὐτοὺς τὴν παραβολὴν ταύτην λέγων·
Matt 18:12	Luke 15:4	0.276068	substitution;reordering	8	7	8	ἄνθρωπος;ἐκ;καταλείπω;ἐν;ὁ;ἔρημος;καί;πορεύομαι	ἐάν;γίνομαι;τις;ἄνθρωπος;εἷς;ὁ;πλανάω	ἐκ;ἄνθρωπος;αὐτός;ἐπί;καί;πορεύομαι;πρόβατον;σύ;ἐνενήκοντα;ἐννέα;ἑκατόν;ὁ	τί ὑμῖν δοκεῖ; ἐὰν γένηταί τινι ἀνθρώπῳ ἑκατὸν πρόβατα καὶ πλανηθῇ ἓν ἐξ αὐτῶν, οὐχὶ ⸀ἀφήσει τὰ ἐνενήκοντα ἐννέα ἐπὶ τὰ ὄρη ⸀καὶ πορευθεὶς ζητεῖ τὸ πλανώμενον;	Τίς ἄνθρωπος ἐξ ὑμῶν ἔχων ἑκατὸν πρόβατα καὶ ⸀ἀπολέσας ⸂ἐξ αὐτῶν ἓν⸃ οὐ καταλείπει τὰ ἐνενήκοντα ἐννέα ἐν τῇ ἐρήμῳ καὶ πορεύεται ἐπὶ τὸ ἀπολωλὸς ἕως εὕρῃ αὐτό;
Matt 18:13	Luke 15:7	0.180039	substitution	9	7	6	χαρά;ἐν;ὁ;οὐρανός;εἰμί;μετανοέω;χρεία;ἔχω;μετάνοια	καί;ἐάν;γίνομαι;εὑρίσκω;αὐτός;ἀμήν;ὁ	ὁ;λέγω;σύ;ὅτι	καὶ ἐὰν γένηται εὑρεῖν αὐτό, ἀμὴν λέγω ὑμῖν ὅτι χαίρει ἐπ’ αὐτῷ μᾶλλον ἢ ἐπὶ τοῖς ἐνενήκοντα ἐννέα τοῖς μὴ πεπλανημένοις.	λέγω ὑμῖν ὅτι οὕτως χαρὰ ⸂ἐν τῷ οὐρανῷ ἔσται⸃ ἐπὶ ἑνὶ ἁμαρτωλῷ μετανοοῦντι ἢ ἐπὶ ἐνενήκοντα ἐννέα δικαίοις οἵτινες οὐ χρείαν ἔχουσιν μετανοίας.
Matt 18:14	Luke 17:2	0.136722	luke_expands;substitution	6	1	10	περίκειμαι;περί;καί;ῥίπτω;εἰς;εἷς	εἷς	εἷς;ἵνα;μικρός;οὗτος;ὁ	οὕτως οὐκ ἔστιν θέλημα ⸀ἔμπροσθεν τοῦ πατρὸς ⸀ὑμῶν τοῦ ἐν οὐρανοῖς ἵνα ἀπόληται ⸀ἓν τῶν μικρῶν τούτων.	λυσιτελεῖ αὐτῷ εἰ ⸂λίθος μυλικὸς⸃ περίκειται περὶ τὸν τράχηλον αὐτοῦ καὶ ἔρριπται εἰς τὴν θάλασσαν ἢ ἵνα σκανδαλίσῃ ⸂τῶν μικρῶν τούτων ἕνα⸃.
