book,idx,ref,short_verse,citation_formula,bracketed_text,text_critical_empty_after_default,cheap_shared,variant_note_count,token_count_default,token_count_full,text_norm_default
Luke,386,Luke 8:35,False,False,False,False,False,1,30,30,εξηλθον δε ιδειν το γεγονοσ και ηλθον προσ τον ιησουν και ευρον καθημενον τον ανθρωπον αφ ου τα δαιμονια εξηλθεν ιματισμενον και σωφρονουντα παρα τουσ ποδασ του ιησου και εφοβηθησαν
Luke,387,Luke 8:36,False,False,False,False,False,1,9,9,απηγγειλαν δε αυτοισ οι ιδοντεσ πωσ εσωθη ο δαιμονισθεισ
Luke,388,Luke 8:37,False,False,False,False,False,3,23,23,και ηρωτησεν αυτον απαν το πληθοσ τησ περιχωρου των γερασηνων απελθειν απ αυτων οτι φοβω μεγαλω συνειχοντο αυτοσ δε εμβασ εισ πλοιον υπεστρεψεν
Luke,389,Luke 8:38,False,False,False,False,False,1,17,17,εδειτο δε αυτου ο ανηρ αφ ου εξεληλυθει τα δαιμονια ειναι συν αυτω απελυσεν δε αυτον λεγων
Luke,390,Luke 8:39,False,False,False,False,False,1,24,24,υποστρεφε εισ τον οικον σου και διηγου οσα σοι εποιησεν ο θεοσ και απηλθεν καθ ολην την πολιν κηρυσσων οσα εποιησεν αυτω ο ιησουσ
Luke,391,Luke 8:40,False,False,False,False,False,2,15,15,εν δε τω υποστρεφειν τον ιησουν απεδεξατο αυτον ο οχλοσ ησαν γαρ παντεσ προσδοκωντεσ αυτον
Luke,392,Luke 8:41,False,False,False,False,False,2,27,27,και ιδου ηλθεν ανηρ ω ονομα ιαιροσ και ουτοσ αρχων τησ συναγωγησ υπηρχεν και πεσων παρα τουσ ποδασ του ιησου παρεκαλει αυτον εισελθειν εισ τον οικον αυτου
Luke,393,Luke 8:42,False,False,False,False,False,0,20,20,οτι θυγατηρ μονογενησ ην αυτω ωσ ετων δωδεκα και αυτη απεθνησκεν εν δε τω υπαγειν αυτον οι οχλοι συνεπνιγον αυτον
Luke,394,Luke 8:43,False,False,False,False,False,2,20,20,και γυνη ουσα εν ρυσει αιματοσ απο ετων δωδεκα ητισ ιατροισ προσαναλωσασα ολον τον βιον ουκ ισχυσεν απ ουδενοσ θεραπευθηναι
Luke,395,Luke 8:44,False,False,False,False,False,0,16,16,προσελθουσα οπισθεν ηψατο του κρασπεδου του ιματιου αυτου και παραχρημα εστη η ρυσισ του αιματοσ αυτησ
Luke,396,Luke 8:45,False,False,False,False,False,2,21,21,και ειπεν ο ιησουσ τισ ο αψαμενοσ μου αρνουμενων δε παντων ειπεν ο πετροσ επιστατα οι οχλοι συνεχουσιν σε και αποθλιβουσιν
Luke,397,Luke 8:46,False,False,False,False,False,1,14,14,ο δε ιησουσ ειπεν ηψατο μου τισ εγω γαρ εγνων δυναμιν εξεληλυθυιαν απ εμου
Luke,398,Luke 8:47,False,False,False,False,False,1,26,26,ιδουσα δε η γυνη οτι ουκ ελαθεν τρεμουσα ηλθεν και προσπεσουσα αυτω δι ην αιτιαν ηψατο αυτου απηγγειλεν ενωπιον παντοσ του λαου και ωσ ιαθη παραχρημα
Luke,399,Luke 8:48,False,False,False,False,False,1,13,13,ο δε ειπεν αυτη θυγατηρ η πιστισ σου σεσωκεν σε πορευου εισ ειρηνην
Luke,400,Luke 8:49,False,False,False,False,False,2,18,18,ετι αυτου λαλουντοσ ερχεται τισ παρα του αρχισυναγωγου λεγων οτι τεθνηκεν η θυγατηρ σου μηκετι σκυλλε τον διδασκαλον
Luke,401,Luke 8:50,False,False,False,False,False,2,12,12,ο δε ιησουσ ακουσασ απεκριθη αυτω μη φοβου μονον πιστευσον και σωθησεται
Luke,402,Luke 8:51,False,False,False,False,False,1,26,26,ελθων δε εισ την οικιαν ουκ αφηκεν εισελθειν τινα συν αυτω ει μη πετρον και ιωαννην και ιακωβον και τον πατερα τησ παιδοσ και την μητερα
Luke,403,Luke 8:52,False,False,False,False,False,1,16,16,εκλαιον δε παντεσ και εκοπτοντο αυτην ο δε ειπεν μη κλαιετε ου γαρ απεθανεν αλλα καθευδει
Luke,404,Luke 8:53,False,False,False,False,False,0,6,6,και κατεγελων αυτου ειδοτεσ οτι απεθανεν
Luke,405,Luke 8:54,False,False,False,False,False,2,11,11,αυτοσ δε κρατησασ τησ χειροσ αυτησ εφωνησεν λεγων η παισ εγειρε
Luke,406,Luke 8:55,False,False,False,False,False,0,13,13,και επεστρεψεν το πνευμα αυτησ και ανεστη παραχρημα και διεταξεν αυτη δοθηναι φαγειν
Luke,407,Luke 8:56,False,False,False,False,False,0,13,13,και εξεστησαν οι γονεισ αυτησ ο δε παρηγγειλεν αυτοισ μηδενι ειπειν το γεγονοσ
Luke,408,Luke 9:1,False,False,False,False,False,0,16,16,συγκαλεσαμενοσ δε τουσ δωδεκα εδωκεν αυτοισ δυναμιν και εξουσιαν επι παντα τα δαιμονια και νοσουσ θεραπευειν
Luke,409,Luke 9:2,False,False,False,False,False,1,12,12,και απεστειλεν αυτουσ κηρυσσειν την βασιλειαν του θεου και ιασθαι τουσ ασθενεισ
Luke,410,Luke 9:3,False,False,False,False,False,2,22,22,και ειπεν προσ αυτουσ μηδεν αιρετε εισ την οδον μητε ραβδον μητε πηραν μητε αρτον μητε αργυριον μητε ανα δυο χιτωνασ εχειν
Luke,411,Luke 9:4,False,False,False,False,False,0,11,11,και εισ ην αν οικιαν εισελθητε εκει μενετε και εκειθεν εξερχεσθε
Luke,412,Luke 9:5,False,False,False,False,False,4,22,22,και οσοι αν μη δεχωνται υμασ εξερχομενοι απο τησ πολεωσ εκεινησ τον κονιορτον απο των ποδων υμων αποτινασσετε εισ μαρτυριον επ αυτουσ
Luke,413,Luke 9:6,False,False,False,False,False,0,10,10,εξερχομενοι δε διηρχοντο κατα τασ κωμασ ευαγγελιζομενοι και θεραπευοντεσ πανταχου
Luke,414,Luke 9:7,False,False,False,False,False,2,20,20,ηκουσεν δε ηρωδησ ο τετρααρχησ τα γινομενα παντα και διηπορει δια το λεγεσθαι υπο τινων οτι ιωαννησ ηγερθη εκ νεκρων
Luke,415,Luke 9:8,False,False,False,False,False,1,14,14,υπο τινων δε οτι ηλιασ εφανη αλλων δε οτι προφητησ τισ των αρχαιων ανεστη
Luke,416,Luke 9:9,False,False,False,False,False,3,19,19,ειπεν δε ο ηρωδησ ιωαννην εγω απεκεφαλισα τισ δε εστιν ουτοσ περι ου ακουω τοιαυτα και εζητει ιδειν αυτον
Luke,417,Luke 9:10,False,False,False,False,False,1,18,18,και υποστρεψαντεσ οι αποστολοι διηγησαντο αυτω οσα εποιησαν και παραλαβων αυτουσ υπεχωρησεν κατ ιδιαν εισ πολιν καλουμενην βηθσαιδα
Luke,418,Luke 9:11,False,False,False,False,False,1,22,22,οι δε οχλοι γνοντεσ ηκολουθησαν αυτω και αποδεξαμενοσ αυτουσ ελαλει αυτοισ περι τησ βασιλειασ του θεου και τουσ χρειαν εχοντασ θεραπειασ ιατο
Luke,419,Luke 9:12,False,False,False,False,False,2,32,32,η δε ημερα ηρξατο κλινειν προσελθοντεσ δε οι δωδεκα ειπαν αυτω απολυσον τον οχλον ινα πορευθεντεσ εισ τασ κυκλω κωμασ και αγρουσ καταλυσωσιν και ευρωσιν επισιτισμον οτι ωδε εν ερημω τοπω εσμεν
Luke,420,Luke 9:13,False,False,False,False,False,2,32,32,ειπεν δε προσ αυτουσ δοτε αυτοισ υμεισ φαγειν οι δε ειπαν ουκ εισιν ημιν πλειον η αρτοι πεντε και ιχθυεσ δυο ει μητι πορευθεντεσ ημεισ αγορασωμεν εισ παντα τον λαον τουτον βρωματα
Luke,421,Luke 9:14,False,False,False,False,False,1,17,17,ησαν γαρ ωσει ανδρεσ πεντακισχιλιοι ειπεν δε προσ τουσ μαθητασ αυτου κατακλινατε αυτουσ κλισιασ ωσει ανα πεντηκοντα
Luke,422,Luke 9:15,False,False,False,False,False,1,6,6,και εποιησαν ουτωσ και κατεκλιναν απαντασ
Luke,423,Luke 9:16,False,False,False,False,False,1,24,24,λαβων δε τουσ πεντε αρτουσ και τουσ δυο ιχθυασ αναβλεψασ εισ τον ουρανον ευλογησεν αυτουσ και κατεκλασεν και εδιδου τοισ μαθηταισ παραθειναι τω οχλω
Luke,424,Luke 9:17,False,False,False,False,False,0,13,13,και εφαγον και εχορτασθησαν παντεσ και ηρθη το περισσευσαν αυτοισ κλασματων κοφινοι δωδεκα
Luke,425,Luke 9:18,False,False,False,False,False,1,23,23,και εγενετο εν τω ειναι αυτον προσευχομενον κατα μονασ συνησαν αυτω οι μαθηται και επηρωτησεν αυτουσ λεγων τινα με οι οχλοι λεγουσιν ειναι
Luke,426,Luke 9:19,False,False,False,False,False,0,18,18,οι δε αποκριθεντεσ ειπαν ιωαννην τον βαπτιστην αλλοι δε ηλιαν αλλοι δε οτι προφητησ τισ των αρχαιων ανεστη
Luke,427,Luke 9:20,False,False,False,False,False,1,17,17,ειπεν δε αυτοισ υμεισ δε τινα με λεγετε ειναι πετροσ δε αποκριθεισ ειπεν τον χριστον του θεου
Luke,428,Luke 9:21,False,False,False,False,False,1,8,8,ο δε επιτιμησασ αυτοισ παρηγγειλεν μηδενι λεγειν τουτο
Luke,429,Luke 9:22,False,False,False,False,False,1,25,25,ειπων οτι δει τον υιον του ανθρωπου πολλα παθειν και αποδοκιμασθηναι απο των πρεσβυτερων και αρχιερεων και γραμματεων και αποκτανθηναι και τη τριτη ημερα εγερθηναι
Luke,430,Luke 9:23,False,False,False,False,False,2,22,22,ελεγεν δε προσ παντασ ει τισ θελει οπισω μου ερχεσθαι αρνησασθω εαυτον και αρατω τον σταυρον αυτου καθ ημεραν και ακολουθειτω μοι
Luke,431,Luke 9:24,False,False,False,False,False,1,22,22,οσ γαρ αν θελη την ψυχην αυτου σωσαι απολεσει αυτην οσ δ αν απολεση την ψυχην αυτου ενεκεν εμου ουτοσ σωσει αυτην
Luke,432,Luke 9:25,False,False,False,False,False,0,13,13,τι γαρ ωφελειται ανθρωποσ κερδησασ τον κοσμον ολον εαυτον δε απολεσασ η ζημιωθεισ
Luke,433,Luke 9:26,False,False,False,False,False,0,28,28,οσ γαρ αν επαισχυνθη με και τουσ εμουσ λογουσ τουτον ο υιοσ του ανθρωπου επαισχυνθησεται οταν ελθη εν τη δοξη αυτου και του πατροσ και των αγιων αγγελων
Luke,434,Luke 9:27,False,False,False,False,False,2,21,21,λεγω δε υμιν αληθωσ εισιν τινεσ των αυτου εστηκοτων οι ου μη γευσωνται θανατου εωσ αν ιδωσιν την βασιλειαν του θεου
Luke,435,Luke 9:28,False,False,False,False,False,1,21,21,εγενετο δε μετα τουσ λογουσ τουτουσ ωσει ημεραι οκτω και παραλαβων πετρον και ιωαννην και ιακωβον ανεβη εισ το οροσ προσευξασθαι
Luke,436,Luke 9:29,False,False,False,False,False,0,18,18,και εγενετο εν τω προσευχεσθαι αυτον το ειδοσ του προσωπου αυτου ετερον και ο ιματισμοσ αυτου λευκοσ εξαστραπτων
Luke,437,Luke 9:30,False,False,False,False,False,0,11,11,και ιδου ανδρεσ δυο συνελαλουν αυτω οιτινεσ ησαν μωυσησ και ηλιασ
Luke,438,Luke 9:31,False,False,False,False,False,0,13,13,οι οφθεντεσ εν δοξη ελεγον την εξοδον αυτου ην ημελλεν πληρουν εν ιερουσαλημ
Luke,439,Luke 9:32,False,False,False,False,False,0,23,23,ο δε πετροσ και οι συν αυτω ησαν βεβαρημενοι υπνω διαγρηγορησαντεσ δε ειδον την δοξαν αυτου και τουσ δυο ανδρασ τουσ συνεστωτασ αυτω
Luke,440,Luke 9:33,False,False,False,False,False,1,36,36,και εγενετο εν τω διαχωριζεσθαι αυτουσ απ αυτου ειπεν ο πετροσ προσ τον ιησουν επιστατα καλον εστιν ημασ ωδε ειναι και ποιησωμεν σκηνασ τρεισ μιαν σοι και μιαν μωυσει και μιαν ηλια μη ειδωσ ο λεγει
Luke,441,Luke 9:34,False,False,False,False,False,2,18,18,ταυτα δε αυτου λεγοντοσ εγενετο νεφελη και επεσκιαζεν αυτουσ εφοβηθησαν δε εν τω εισελθειν αυτουσ εισ την νεφελην
Luke,442,Luke 9:35,False,False,False,False,False,1,16,16,και φωνη εγενετο εκ τησ νεφελησ λεγουσα ουτοσ εστιν ο υιοσ μου ο εκλελεγμενοσ αυτου ακουετε
Luke,443,Luke 9:36,False,False,False,False,False,1,22,22,και εν τω γενεσθαι την φωνην ευρεθη ιησουσ μονοσ και αυτοι εσιγησαν και ουδενι απηγγειλαν εν εκειναισ ταισ ημεραισ ουδεν ων εωρακαν
Luke,444,Luke 9:37,False,False,False,False,False,1,14,14,εγενετο δε τη εξησ ημερα κατελθοντων αυτων απο του ορουσ συνηντησεν αυτω οχλοσ πολυσ
Luke,445,Luke 9:38,False,False,False,False,False,2,20,20,και ιδου ανηρ απο του οχλου εβοησεν λεγων διδασκαλε δεομαι σου επιβλεψαι επι τον υιον μου οτι μονογενησ μοι εστιν
Luke,446,Luke 9:39,False,False,False,False,False,1,20,20,και ιδου πνευμα λαμβανει αυτον και εξαιφνησ κραζει και σπαρασσει αυτον μετα αφρου και μογισ αποχωρει απ αυτου συντριβον αυτον
Luke,447,Luke 9:40,False,False,False,False,False,0,11,11,και εδεηθην των μαθητων σου ινα εκβαλωσιν αυτο και ουκ ηδυνηθησαν
Luke,448,Luke 9:41,False,False,False,False,False,1,23,23,αποκριθεισ δε ο ιησουσ ειπεν ω γενεα απιστοσ και διεστραμμενη εωσ ποτε εσομαι προσ υμασ και ανεξομαι υμων προσαγαγε ωδε τον υιον σου
Luke,449,Luke 9:42,False,False,False,False,False,0,28,28,ετι δε προσερχομενου αυτου ερρηξεν αυτον το δαιμονιον και συνεσπαραξεν επετιμησεν δε ο ιησουσ τω πνευματι τω ακαθαρτω και ιασατο τον παιδα και απεδωκεν αυτον τω πατρι αυτου
Luke,450,Luke 9:43,False,False,False,False,False,1,20,20,εξεπλησσοντο δε παντεσ επι τη μεγαλειοτητι του θεου παντων δε θαυμαζοντων επι πασιν οισ εποιει ειπεν προσ τουσ μαθητασ αυτου
Luke,451,Luke 9:44,False,False,False,False,False,0,19,19,θεσθε υμεισ εισ τα ωτα υμων τουσ λογουσ τουτουσ ο γαρ υιοσ του ανθρωπου μελλει παραδιδοσθαι εισ χειρασ ανθρωπων
Luke,452,Luke 9:45,False,False,False,False,False,0,23,23,οι δε ηγνοουν το ρημα τουτο και ην παρακεκαλυμμενον απ αυτων ινα μη αισθωνται αυτο και εφοβουντο ερωτησαι αυτον περι του ρηματοσ τουτου
Luke,453,Luke 9:46,False,False,False,False,False,0,11,11,εισηλθεν δε διαλογισμοσ εν αυτοισ το τισ αν ειη μειζων αυτων
Luke,454,Luke 9:47,False,False,False,False,False,2,15,15,ο δε ιησουσ ειδωσ τον διαλογισμον τησ καρδιασ αυτων επιλαβομενοσ παιδιον εστησεν αυτο παρ εαυτω
Luke,455,Luke 9:48,False,False,False,False,False,3,34,34,και ειπεν αυτοισ οσ αν δεξηται τουτο το παιδιον επι τω ονοματι μου εμε δεχεται και οσ αν εμε δεξηται δεχεται τον αποστειλαντα με ο γαρ μικροτεροσ εν πασιν υμιν υπαρχων ουτοσ εστιν μεγασ
Luke,456,Luke 9:49,False,False,False,False,False,3,21,21,αποκριθεισ δε ιωαννησ ειπεν επιστατα ειδομεν τινα εν τω ονοματι σου εκβαλλοντα δαιμονια και εκωλυομεν αυτον οτι ουκ ακολουθει μεθ ημων
Luke,457,Luke 9:50,False,False,False,False,False,3,17,17,ειπεν δε προσ αυτον ο ιησουσ μη κωλυετε οσ γαρ ουκ εστιν καθ υμων υπερ υμων εστιν
Luke,458,Luke 9:51,False,False,False,False,False,2,19,19,εγενετο δε εν τω συμπληρουσθαι τασ ημερασ τησ αναλημψεωσ αυτου και αυτοσ το προσωπον εστηρισεν του πορευεσθαι εισ ιερουσαλημ
Luke,459,Luke 9:52,False,False,False,False,False,1,15,15,και απεστειλεν αγγελουσ προ προσωπου αυτου και πορευθεντεσ εισηλθον εισ κωμην σαμαριτων ωσ ετοιμασαι αυτω
Luke,460,Luke 9:53,False,False,False,False,False,0,12,12,και ουκ εδεξαντο αυτον οτι το προσωπον αυτου ην πορευομενον εισ ιερουσαλημ
Luke,461,Luke 9:54,False,False,False,False,False,2,19,19,ιδοντεσ δε οι μαθηται ιακωβοσ και ιωαννησ ειπαν κυριε θελεισ ειπωμεν πυρ καταβηναι απο του ουρανου και αναλωσαι αυτουσ
Luke,462,Luke 9:55,False,False,False,False,False,1,4,4,στραφεισ δε επετιμησεν αυτοισ
Luke,463,Luke 9:56,False,False,False,False,False,1,5,5,και επορευθησαν εισ ετεραν κωμην
Luke,464,Luke 9:57,False,False,False,False,False,3,15,15,και πορευομενων αυτων εν τη οδω ειπεν τισ προσ αυτον ακολουθησω σοι οπου εαν απερχη
Luke,465,Luke 9:58,False,False,False,False,False,0,26,26,και ειπεν αυτω ο ιησουσ αι αλωπεκεσ φωλεουσ εχουσιν και τα πετεινα του ουρανου κατασκηνωσεισ ο δε υιοσ του ανθρωπου ουκ εχει που την κεφαλην κλινη
Luke,466,Luke 9:59,False,False,False,False,False,2,18,18,ειπεν δε προσ ετερον ακολουθει μοι ο δε ειπεν κυριε επιτρεψον μοι απελθοντι πρωτον θαψαι τον πατερα μου
Luke,467,Luke 9:60,False,False,False,False,False,1,18,18,ειπεν δε αυτω αφεσ τουσ νεκρουσ θαψαι τουσ εαυτων νεκρουσ συ δε απελθων διαγγελλε την βασιλειαν του θεου
Luke,468,Luke 9:61,False,False,False,False,False,0,17,17,ειπεν δε και ετεροσ ακολουθησω σοι κυριε πρωτον δε επιτρεψον μοι αποταξασθαι τοισ εισ τον οικον μου
Luke,469,Luke 9:62,False,False,False,False,False,3,21,21,ειπεν δε ο ιησουσ ουδεισ επιβαλων την χειρα επ αροτρον και βλεπων εισ τα οπισω ευθετοσ εστιν τη βασιλεια του θεου
Luke,470,Luke 10:1,False,False,False,False,False,3,28,28,μετα δε ταυτα ανεδειξεν ο κυριοσ και ετερουσ εβδομηκοντα δυο και απεστειλεν αυτουσ ανα δυο δυο προ προσωπου αυτου εισ πασαν πολιν και τοπον ου ημελλεν αυτοσ ερχεσθαι
Luke,471,Luke 10:2,False,False,False,False,False,2,25,25,ελεγεν δε προσ αυτουσ ο μεν θερισμοσ πολυσ οι δε εργαται ολιγοι δεηθητε ουν του κυριου του θερισμου οπωσ εργατασ εκβαλη εισ τον θερισμον αυτου
Luke,472,Luke 10:3,False,False,False,False,False,1,9,9,υπαγετε ιδου αποστελλω υμασ ωσ αρνασ εν μεσω λυκων
Luke,473,Luke 10:4,False,False,False,False,False,1,13,13,μη βασταζετε βαλλαντιον μη πηραν μη υποδηματα και μηδενα κατα την οδον ασπασησθε
Luke,474,Luke 10:5,False,False,False,False,False,1,12,12,εισ ην δ αν εισελθητε οικιαν πρωτον λεγετε ειρηνη τω οικω τουτω
Luke,475,Luke 10:6,False,False,False,False,False,1,18,18,και εαν η εκει υιοσ ειρηνησ επαναπαησεται επ αυτον η ειρηνη υμων ει δε μηγε εφ υμασ ανακαμψει
Luke,476,Luke 10:7,False,False,False,False,False,1,25,25,εν αυτη δε τη οικια μενετε εσθιοντεσ και πινοντεσ τα παρ αυτων αξιοσ γαρ ο εργατησ του μισθου αυτου μη μεταβαινετε εξ οικιασ εισ οικιαν
Luke,477,Luke 10:8,False,False,False,False,False,0,13,13,και εισ ην αν πολιν εισερχησθε και δεχωνται υμασ εσθιετε τα παρατιθεμενα υμιν
Luke,478,Luke 10:9,False,False,False,False,False,0,16,16,και θεραπευετε τουσ εν αυτη ασθενεισ και λεγετε αυτοισ ηγγικεν εφ υμασ η βασιλεια του θεου
Luke,479,Luke 10:10,False,False,False,False,False,1,16,16,εισ ην δ αν πολιν εισελθητε και μη δεχωνται υμασ εξελθοντεσ εισ τασ πλατειασ αυτησ ειπατε
Luke,480,Luke 10:11,False,False,False,False,False,2,24,24,και τον κονιορτον τον κολληθεντα ημιν εκ τησ πολεωσ υμων εισ τουσ ποδασ απομασσομεθα υμιν πλην τουτο γινωσκετε οτι ηγγικεν η βασιλεια του θεου
Luke,481,Luke 10:12,False,False,False,False,False,0,14,14,λεγω υμιν οτι σοδομοισ εν τη ημερα εκεινη ανεκτοτερον εσται η τη πολει εκεινη
Luke,482,Luke 10:13,False,False,False,False,False,2,27,27,ουαι σοι χοραζιν ουαι σοι βηθσαιδα οτι ει εν τυρω και σιδωνι εγενηθησαν αι δυναμεισ αι γενομεναι εν υμιν παλαι αν εν σακκω και σποδω καθημενοι μετενοησαν
Luke,483,Luke 10:14,False,False,False,False,False,0,11,11,πλην τυρω και σιδωνι ανεκτοτερον εσται εν τη κρισει η υμιν
Luke,484,Luke 10:15,False,False,False,False,False,3,11,11,και συ καφαρναουμ μη εωσ ουρανου υψωθηση εωσ του αδου καταβιβασθηση
Luke,485,Luke 10:16,False,False,False,False,False,0,19,19,ο ακουων υμων εμου ακουει και ο αθετων υμασ εμε αθετει ο δε εμε αθετων αθετει τον αποστειλαντα με
Luke,486,Luke 10:17,False,False,False,False,False,1,18,18,υπεστρεψαν δε οι εβδομηκοντα δυο μετα χαρασ λεγοντεσ κυριε και τα δαιμονια υποτασσεται ημιν εν τω ονοματι σου
