book,idx,ref,short_verse,citation_formula,bracketed_text,text_critical_empty_after_default,cheap_shared,variant_note_count,token_count_default,token_count_full,text_norm_default
Matt,79,Matt 4:15,False,False,False,False,False,0,13,13,γη ζαβουλων και γη νεφθαλιμ οδον θαλασσησ περαν του ιορδανου γαλιλαια των εθνων
Matt,80,Matt 4:16,False,False,False,False,False,0,20,20,ο λαοσ ο καθημενοσ εν σκοτια φωσ ειδεν μεγα και τοισ καθημενοισ εν χωρα και σκια θανατου φωσ ανετειλεν αυτοισ
Matt,81,Matt 4:17,False,False,False,False,False,0,15,15,απο τοτε ηρξατο ο ιησουσ κηρυσσειν και λεγειν μετανοειτε ηγγικεν γαρ η βασιλεια των ουρανων
Matt,82,Matt 4:18,False,False,False,False,False,0,27,27,περιπατων δε παρα την θαλασσαν τησ γαλιλαιασ ειδεν δυο αδελφουσ σιμωνα τον λεγομενον πετρον και ανδρεαν τον αδελφον αυτου βαλλοντασ αμφιβληστρον εισ την θαλασσαν ησαν γαρ αλιεισ
Matt,83,Matt 4:19,False,False,False,False,False,0,11,11,και λεγει αυτοισ δευτε οπισω μου και ποιησω υμασ αλιεισ ανθρωπων
Matt,84,Matt 4:20,False,False,False,False,False,0,8,8,οι δε ευθεωσ αφεντεσ τα δικτυα ηκολουθησαν αυτω
Matt,85,Matt 4:21,False,False,False,False,False,0,31,31,και προβασ εκειθεν ειδεν αλλουσ δυο αδελφουσ ιακωβον τον του ζεβεδαιου και ιωαννην τον αδελφον αυτου εν τω πλοιω μετα ζεβεδαιου του πατροσ αυτων καταρτιζοντασ τα δικτυα αυτων και εκαλεσεν αυτουσ
Matt,86,Matt 4:22,False,False,False,False,False,0,12,12,οι δε ευθεωσ αφεντεσ το πλοιον και τον πατερα αυτων ηκολουθησαν αυτω
Matt,87,Matt 4:23,False,False,False,False,False,0,27,27,και περιηγεν εν ολη τη γαλιλαια διδασκων εν ταισ συναγωγαισ αυτων και κηρυσσων το ευαγγελιον τησ βασιλειασ και θεραπευων πασαν νοσον και πασαν μαλακιαν εν τω λαω
Matt,88,Matt 4:24,False,False,False,False,False,0,29,29,και απηλθεν η ακοη αυτου εισ ολην την συριαν και προσηνεγκαν αυτω παντασ τουσ κακωσ εχοντασ ποικιλαισ νοσοισ και βασανοισ συνεχομενουσ δαιμονιζομενουσ και σεληνιαζομενουσ και παραλυτικουσ και εθεραπευσεν αυτουσ
Matt,89,Matt 4:25,False,False,False,False,False,0,18,18,και ηκολουθησαν αυτω οχλοι πολλοι απο τησ γαλιλαιασ και δεκαπολεωσ και ιεροσολυμων και ιουδαιασ και περαν του ιορδανου
Matt,90,Matt 5:1,False,False,False,False,False,0,16,16,ιδων δε τουσ οχλουσ ανεβη εισ το οροσ και καθισαντοσ αυτου προσηλθαν αυτω οι μαθηται αυτου
Matt,91,Matt 5:2,False,False,False,False,False,0,8,8,και ανοιξασ το στομα αυτου εδιδασκεν αυτουσ λεγων
Matt,92,Matt 5:3,False,False,False,False,False,0,12,12,μακαριοι οι πτωχοι τω πνευματι οτι αυτων εστιν η βασιλεια των ουρανων
Matt,93,Matt 5:4,False,False,False,False,False,0,6,6,μακαριοι οι πενθουντεσ οτι αυτοι παρακληθησονται
Matt,94,Matt 5:5,False,False,False,False,False,0,8,8,μακαριοι οι πραεισ οτι αυτοι κληρονομησουσι την γην
Matt,95,Matt 5:6,False,False,False,False,False,0,10,10,μακαριοι οι πεινωντεσ και διψωντεσ την δικαιοσυνην οτι αυτοι χορτασθησονται
Matt,96,Matt 5:7,False,False,False,False,False,0,6,6,μακαριοι οι ελεημονεσ οτι αυτοι ελεηθησονται
Matt,97,Matt 5:8,False,False,False,False,False,0,10,10,μακαριοι οι καθαροι τη καρδια οτι αυτοι τον θεον οψονται
Matt,98,Matt 5:9,False,False,False,False,False,0,8,8,μακαριοι οι ειρηνοποιοι οτι αυτοι υιοι θεου κληθησονται
Matt,99,Matt 5:10,False,False,False,False,False,0,12,12,μακαριοι οι δεδιωγμενοι ενεκεν δικαιοσυνησ οτι αυτων εστιν η βασιλεια των ουρανων
Matt,100,Matt 5:11,False,False,False,False,False,0,16,16,μακαριοι εστε οταν ονειδισωσιν υμασ και διωξωσιν και ειπωσιν παν πονηρον καθ υμων ψευδομενοι ενεκεν εμου
Matt,101,Matt 5:12,False,False,False,False,False,0,19,19,χαιρετε και αγαλλιασθε οτι ο μισθοσ υμων πολυσ εν τοισ ουρανοισ ουτωσ γαρ εδιωξαν τουσ προφητασ τουσ προ υμων
Matt,102,Matt 5:13,False,False,False,False,False,0,26,26,υμεισ εστε το αλασ τησ γησ εαν δε το αλασ μωρανθη εν τινι αλισθησεται εισ ουδεν ισχυει ετι ει μη βληθεν εξω καταπατεισθαι υπο των ανθρωπων
Matt,103,Matt 5:14,False,False,False,False,False,0,13,13,υμεισ εστε το φωσ του κοσμου ου δυναται πολισ κρυβηναι επανω ορουσ κειμενη
Matt,104,Matt 5:15,False,False,False,False,False,0,20,20,ουδε καιουσιν λυχνον και τιθεασιν αυτον υπο τον μοδιον αλλ επι την λυχνιαν και λαμπει πασιν τοισ εν τη οικια
Matt,105,Matt 5:16,False,False,False,False,False,0,23,23,ουτωσ λαμψατω το φωσ υμων εμπροσθεν των ανθρωπων οπωσ ιδωσιν υμων τα καλα εργα και δοξασωσιν τον πατερα υμων τον εν τοισ ουρανοισ
Matt,106,Matt 5:17,False,False,False,False,False,0,15,15,μη νομισητε οτι ηλθον καταλυσαι τον νομον η τουσ προφητασ ουκ ηλθον καταλυσαι αλλα πληρωσαι
Matt,107,Matt 5:18,False,False,False,False,False,0,27,27,αμην γαρ λεγω υμιν εωσ αν παρελθη ο ουρανοσ και η γη ιωτα εν η μια κεραια ου μη παρελθη απο του νομου εωσ αν παντα γενηται
Matt,108,Matt 5:19,False,False,False,False,False,0,36,36,οσ εαν ουν λυση μιαν των εντολων τουτων των ελαχιστων και διδαξη ουτωσ τουσ ανθρωπουσ ελαχιστοσ κληθησεται εν τη βασιλεια των ουρανων οσ δ αν ποιηση και διδαξη ουτοσ μεγασ κληθησεται εν τη βασιλεια των ουρανων
Matt,109,Matt 5:20,False,False,False,False,False,0,23,23,λεγω γαρ υμιν οτι εαν μη περισσευση υμων η δικαιοσυνη πλειον των γραμματεων και φαρισαιων ου μη εισελθητε εισ την βασιλειαν των ουρανων
Matt,110,Matt 5:21,False,False,False,False,False,0,15,15,ηκουσατε οτι ερρεθη τοισ αρχαιοισ ου φονευσεισ οσ δ αν φονευση ενοχοσ εσται τη κρισει
Matt,111,Matt 5:22,False,False,False,False,False,0,39,39,εγω δε λεγω υμιν οτι πασ ο οργιζομενοσ τω αδελφω αυτου ενοχοσ εσται τη κρισει οσ δ αν ειπη τω αδελφω αυτου ρακα ενοχοσ εσται τω συνεδριω οσ δ αν ειπη μωρε ενοχοσ εσται εισ την γεενναν του πυροσ
Matt,112,Matt 5:23,False,False,False,False,False,0,19,19,εαν ουν προσφερησ το δωρον σου επι το θυσιαστηριον κακει μνησθησ οτι ο αδελφοσ σου εχει τι κατα σου
Matt,113,Matt 5:24,False,False,False,False,False,0,22,22,αφεσ εκει το δωρον σου εμπροσθεν του θυσιαστηριου και υπαγε πρωτον διαλλαγηθι τω αδελφω σου και τοτε ελθων προσφερε το δωρον σου
Matt,114,Matt 5:25,False,False,False,False,False,0,30,30,ισθι ευνοων τω αντιδικω σου ταχυ εωσ οτου ει μετ αυτου εν τη οδω μηποτε σε παραδω ο αντιδικοσ τω κριτη και ο κριτησ τω υπηρετη και εισ φυλακην βληθηση
Matt,115,Matt 5:26,False,False,False,False,False,0,13,13,αμην λεγω σοι ου μη εξελθησ εκειθεν εωσ αν αποδωσ τον εσχατον κοδραντην
Matt,116,Matt 5:27,False,False,False,False,False,0,5,5,ηκουσατε οτι ερρεθη ου μοιχευσεισ
Matt,117,Matt 5:28,False,False,False,False,False,0,20,20,εγω δε λεγω υμιν οτι πασ ο βλεπων γυναικα προσ το επιθυμησαι αυτην ηδη εμοιχευσεν αυτην εν τη καρδια αυτου
Matt,118,Matt 5:29,False,False,False,False,False,0,33,33,ει δε ο οφθαλμοσ σου ο δεξιοσ σκανδαλιζει σε εξελε αυτον και βαλε απο σου συμφερει γαρ σοι ινα αποληται εν των μελων σου και μη ολον το σωμα σου βληθη εισ γεενναν
Matt,119,Matt 5:30,False,False,False,False,False,0,32,32,και ει η δεξια σου χειρ σκανδαλιζει σε εκκοψον αυτην και βαλε απο σου συμφερει γαρ σοι ινα αποληται εν των μελων σου και μη ολον το σωμα σου εισ γεενναν απελθη
Matt,120,Matt 5:31,False,False,False,False,False,0,11,11,ερρεθη δε οσ αν απολυση την γυναικα αυτου δοτω αυτη αποστασιον
Matt,121,Matt 5:32,False,False,False,False,False,0,23,23,εγω δε λεγω υμιν οτι πασ ο απολυων την γυναικα αυτου παρεκτοσ λογου πορνειασ ποιει αυτην μοιχευθηναι και οσ εαν απολελυμενην γαμηση μοιχαται
Matt,122,Matt 5:33,False,False,False,False,False,0,15,15,παλιν ηκουσατε οτι ερρεθη τοισ αρχαιοισ ουκ επιορκησεισ αποδωσεισ δε τω κυριω τουσ ορκουσ σου
Matt,123,Matt 5:34,False,False,False,False,False,0,16,16,εγω δε λεγω υμιν μη ομοσαι ολωσ μητε εν τω ουρανω οτι θρονοσ εστιν του θεου
Matt,124,Matt 5:35,False,False,False,False,False,0,19,19,μητε εν τη γη οτι υποποδιον εστιν των ποδων αυτου μητε εισ ιεροσολυμα οτι πολισ εστιν του μεγαλου βασιλεωσ
Matt,125,Matt 5:36,False,False,False,False,False,0,15,15,μητε εν τη κεφαλη σου ομοσησ οτι ου δυνασαι μιαν τριχα λευκην ποιησαι η μελαιναν
Matt,126,Matt 5:37,False,False,False,False,False,0,17,17,εστω δε ο λογοσ υμων ναι ναι ου ου το δε περισσον τουτων εκ του πονηρου εστιν
Matt,127,Matt 5:38,False,False,False,False,False,0,10,10,ηκουσατε οτι ερρεθη οφθαλμον αντι οφθαλμου και οδοντα αντι οδοντοσ
Matt,128,Matt 5:39,False,False,False,False,False,0,21,21,εγω δε λεγω υμιν μη αντιστηναι τω πονηρω αλλ οστισ σε ραπιζει εισ την δεξιαν σιαγονα στρεψον αυτω και την αλλην
Matt,129,Matt 5:40,False,False,False,False,False,0,15,15,και τω θελοντι σοι κριθηναι και τον χιτωνα σου λαβειν αφεσ αυτω και το ιματιον
Matt,130,Matt 5:41,False,False,False,False,False,0,10,10,και οστισ σε αγγαρευσει μιλιον εν υπαγε μετ αυτου δυο
Matt,131,Matt 5:42,False,False,False,False,False,0,12,12,τω αιτουντι σε δοσ και τον θελοντα απο σου δανισασθαι μη αποστραφησ
Matt,132,Matt 5:43,False,False,False,False,False,0,12,12,ηκουσατε οτι ερρεθη αγαπησεισ τον πλησιον σου και μισησεισ τον εχθρον σου
Matt,133,Matt 5:44,False,False,False,False,False,0,14,14,εγω δε λεγω υμιν αγαπατε τουσ εχθρουσ υμων και προσευχεσθε υπερ των διωκοντων υμασ
Matt,134,Matt 5:45,False,False,False,False,False,0,24,24,οπωσ γενησθε υιοι του πατροσ υμων του εν ουρανοισ οτι τον ηλιον αυτου ανατελλει επι πονηρουσ και αγαθουσ και βρεχει επι δικαιουσ και αδικουσ
Matt,135,Matt 5:46,False,False,False,False,False,0,16,16,εαν γαρ αγαπησητε τουσ αγαπωντασ υμασ τινα μισθον εχετε ουχι και οι τελωναι το αυτο ποιουσιν
Matt,136,Matt 5:47,False,False,False,False,False,0,17,17,και εαν ασπασησθε τουσ αδελφουσ υμων μονον τι περισσον ποιειτε ουχι και οι εθνικοι το αυτο ποιουσιν
Matt,137,Matt 5:48,False,False,False,False,False,0,12,12,εσεσθε ουν υμεισ τελειοι ωσ ο πατηρ υμων ο ουρανιοσ τελειοσ εστιν
Matt,138,Matt 6:1,False,False,False,False,False,0,29,29,προσεχετε δε την δικαιοσυνην υμων μη ποιειν εμπροσθεν των ανθρωπων προσ το θεαθηναι αυτοισ ει δε μη γε μισθον ουκ εχετε παρα τω πατρι υμων τω εν τοισ ουρανοισ
Matt,139,Matt 6:2,False,False,False,False,False,0,31,31,οταν ουν ποιησ ελεημοσυνην μη σαλπισησ εμπροσθεν σου ωσπερ οι υποκριται ποιουσιν εν ταισ συναγωγαισ και εν ταισ ρυμαισ οπωσ δοξασθωσιν υπο των ανθρωπων αμην λεγω υμιν απεχουσιν τον μισθον αυτων
Matt,140,Matt 6:3,False,False,False,False,False,0,14,14,σου δε ποιουντοσ ελεημοσυνην μη γνωτω η αριστερα σου τι ποιει η δεξια σου
Matt,141,Matt 6:4,False,False,False,False,False,0,19,19,οπωσ η σου η ελεημοσυνη εν τω κρυπτω και ο πατηρ σου ο βλεπων εν τω κρυπτω αποδωσει σοι
Matt,142,Matt 6:5,False,False,False,False,False,0,32,32,και οταν προσευχησθε ουκ εσεσθε ωσ οι υποκριται οτι φιλουσιν εν ταισ συναγωγαισ και εν ταισ γωνιαισ των πλατειων εστωτεσ προσευχεσθαι οπωσ φανωσιν τοισ ανθρωποισ αμην λεγω υμιν απεχουσι τον μισθον αυτων
Matt,143,Matt 6:6,False,False,False,False,False,0,33,33,συ δε οταν προσευχη εισελθε εισ το ταμειον σου και κλεισασ την θυραν σου προσευξαι τω πατρι σου τω εν τω κρυπτω και ο πατηρ σου ο βλεπων εν τω κρυπτω αποδωσει σοι
Matt,144,Matt 6:7,False,False,False,False,False,0,15,15,προσευχομενοι δε μη βατταλογησητε ωσπερ οι εθνικοι δοκουσιν γαρ οτι εν τη πολυλογια αυτων εισακουσθησονται
Matt,145,Matt 6:8,False,False,False,False,False,0,17,17,μη ουν ομοιωθητε αυτοισ οιδεν γαρ ο πατηρ υμων ων χρειαν εχετε προ του υμασ αιτησαι αυτον
Matt,146,Matt 6:9,False,False,False,False,False,0,14,14,ουτωσ ουν προσευχεσθε υμεισ πατερ ημων ο εν τοισ ουρανοισ αγιασθητω το ονομα σου
Matt,147,Matt 6:10,False,False,False,False,False,0,14,14,ελθετω η βασιλεια σου γενηθητω το θελημα σου ωσ εν ουρανω και επι γησ
Matt,148,Matt 6:11,False,False,False,False,False,0,8,8,τον αρτον ημων τον επιουσιον δοσ ημιν σημερον
Matt,149,Matt 6:12,False,False,False,False,False,0,13,13,και αφεσ ημιν τα οφειληματα ημων ωσ και ημεισ αφηκαμεν τοισ οφειλεταισ ημων
Matt,150,Matt 6:13,False,False,False,False,False,0,12,12,και μη εισενεγκησ ημασ εισ πειρασμον αλλα ρυσαι ημασ απο του πονηρου
Matt,151,Matt 6:14,False,False,False,False,False,0,16,16,εαν γαρ αφητε τοισ ανθρωποισ τα παραπτωματα αυτων αφησει και υμιν ο πατηρ υμων ο ουρανιοσ
Matt,152,Matt 6:15,False,False,False,False,False,0,14,14,εαν δε μη αφητε τοισ ανθρωποισ ουδε ο πατηρ υμων αφησει τα παραπτωματα υμων
Matt,153,Matt 6:16,False,False,False,False,False,0,26,26,οταν δε νηστευητε μη γινεσθε ωσ οι υποκριται σκυθρωποι αφανιζουσιν γαρ τα προσωπα αυτων οπωσ φανωσιν τοισ ανθρωποισ νηστευοντεσ αμην λεγω υμιν απεχουσιν τον μισθον αυτων
Matt,154,Matt 6:17,False,False,False,False,False,0,12,12,συ δε νηστευων αλειψαι σου την κεφαλην και το προσωπον σου νιψαι
Matt,155,Matt 6:18,False,False,False,False,False,0,25,25,οπωσ μη φανησ τοισ ανθρωποισ νηστευων αλλα τω πατρι σου τω εν τω κρυφαιω και ο πατηρ σου ο βλεπων εν τω κρυφαιω αποδωσει σοι
Matt,156,Matt 6:19,False,False,False,False,False,0,18,18,μη θησαυριζετε υμιν θησαυρουσ επι τησ γησ οπου σησ και βρωσισ αφανιζει και οπου κλεπται διορυσσουσιν και κλεπτουσιν
Matt,157,Matt 6:20,False,False,False,False,False,0,19,19,θησαυριζετε δε υμιν θησαυρουσ εν ουρανω οπου ουτε σησ ουτε βρωσισ αφανιζει και οπου κλεπται ου διορυσσουσιν ουδε κλεπτουσιν
Matt,158,Matt 6:21,False,False,False,False,False,0,12,12,οπου γαρ εστιν ο θησαυροσ σου εκει εσται και η καρδια σου
Matt,159,Matt 6:22,False,False,False,False,False,0,20,20,ο λυχνοσ του σωματοσ εστιν ο οφθαλμοσ εαν ουν η ο οφθαλμοσ σου απλουσ ολον το σωμα σου φωτεινον εσται
Matt,160,Matt 6:23,False,False,False,False,False,0,25,25,εαν δε ο οφθαλμοσ σου πονηροσ η ολον το σωμα σου σκοτεινον εσται ει ουν το φωσ το εν σοι σκοτοσ εστιν το σκοτοσ ποσον
Matt,161,Matt 6:24,False,False,False,False,False,0,27,27,ουδεισ δυναται δυσι κυριοισ δουλευειν η γαρ τον ενα μισησει και τον ετερον αγαπησει η ενοσ ανθεξεται και του ετερου καταφρονησει ου δυνασθε θεω δουλευειν και μαμωνα
Matt,162,Matt 6:25,False,False,False,False,False,0,29,29,δια τουτο λεγω υμιν μη μεριμνατε τη ψυχη υμων τι φαγητε μηδε τω σωματι υμων τι ενδυσησθε ουχι η ψυχη πλειον εστι τησ τροφησ και το σωμα του ενδυματοσ
Matt,163,Matt 6:26,False,False,False,False,False,0,28,28,εμβλεψατε εισ τα πετεινα του ουρανου οτι ου σπειρουσιν ουδε θεριζουσιν ουδε συναγουσιν εισ αποθηκασ και ο πατηρ υμων ο ουρανιοσ τρεφει αυτα ουχ υμεισ μαλλον διαφερετε αυτων
Matt,164,Matt 6:27,False,False,False,False,False,0,13,13,τισ δε εξ υμων μεριμνων δυναται προσθειναι επι την ηλικιαν αυτου πηχυν ενα
Matt,165,Matt 6:28,False,False,False,False,False,0,16,16,και περι ενδυματοσ τι μεριμνατε καταμαθετε τα κρινα του αγρου πωσ αυξανουσιν ου κοπιωσιν ουδε νηθουσιν
Matt,166,Matt 6:29,False,False,False,False,False,0,15,15,λεγω δε υμιν οτι ουδε σολομων εν παση τη δοξη αυτου περιεβαλετο ωσ εν τουτων
Matt,167,Matt 6:30,False,False,False,False,False,0,22,22,ει δε τον χορτον του αγρου σημερον οντα και αυριον εισ κλιβανον βαλλομενον ο θεοσ ουτωσ αμφιεννυσιν ου πολλω μαλλον υμασ ολιγοπιστοι
Matt,168,Matt 6:31,False,False,False,False,False,0,12,12,μη ουν μεριμνησητε λεγοντεσ τι φαγωμεν η τι πιωμεν η τι περιβαλωμεθα
Matt,169,Matt 6:32,False,False,False,False,False,0,17,17,παντα γαρ ταυτα τα εθνη επιζητουσιν οιδεν γαρ ο πατηρ υμων ο ουρανιοσ οτι χρηζετε τουτων απαντων
Matt,170,Matt 6:33,False,False,False,False,False,0,14,14,ζητειτε δε πρωτον την βασιλειαν και την δικαιοσυνην αυτου και ταυτα παντα προστεθησεται υμιν
Matt,171,Matt 6:34,False,False,False,False,False,0,17,17,μη ουν μεριμνησητε εισ την αυριον η γαρ αυριον μεριμνησει αυτησ αρκετον τη ημερα η κακια αυτησ
Matt,172,Matt 7:1,False,False,False,False,False,0,5,5,μη κρινετε ινα μη κριθητε
Matt,173,Matt 7:2,False,False,False,False,False,0,13,13,εν ω γαρ κριματι κρινετε κριθησεσθε και εν ω μετρω μετρειτε μετρηθησεται υμιν
Matt,174,Matt 7:3,False,False,False,False,False,0,21,21,τι δε βλεπεισ το καρφοσ το εν τω οφθαλμω του αδελφου σου την δε εν τω σω οφθαλμω δοκον ου κατανοεισ
Matt,175,Matt 7:4,False,False,False,False,False,0,22,22,η πωσ ερεισ τω αδελφω σου αφεσ εκβαλω το καρφοσ εκ του οφθαλμου σου και ιδου η δοκοσ εν τω οφθαλμω σου
Matt,176,Matt 7:5,False,False,False,False,False,0,21,21,υποκριτα εκβαλε πρωτον εκ του οφθαλμου σου την δοκον και τοτε διαβλεψεισ εκβαλειν το καρφοσ εκ του οφθαλμου του αδελφου σου
Matt,177,Matt 7:6,False,False,False,False,False,0,25,25,μη δωτε το αγιον τοισ κυσιν μηδε βαλητε τουσ μαργαριτασ υμων εμπροσθεν των χοιρων μηποτε καταπατησουσιν αυτουσ εν τοισ ποσιν αυτων και στραφεντεσ ρηξωσιν υμασ
Matt,178,Matt 7:7,False,False,False,False,False,0,11,11,αιτειτε και δοθησεται υμιν ζητειτε και ευρησετε κρουετε και ανοιγησεται υμιν
Matt,179,Matt 7:8,False,False,False,False,False,0,13,13,πασ γαρ ο αιτων λαμβανει και ο ζητων ευρισκει και τω κρουοντι ανοιγησεται
Matt,180,Matt 7:9,False,False,False,False,False,0,16,16,η τισ εστιν εξ υμων ανθρωποσ ον αιτησει ο υιοσ αυτου αρτον μη λιθον επιδωσει αυτω
Matt,181,Matt 7:10,False,False,False,False,False,0,8,8,η και ιχθυν αιτησει μη οφιν επιδωσει αυτω
Matt,182,Matt 7:11,False,False,False,False,False,0,26,26,ει ουν υμεισ πονηροι οντεσ οιδατε δοματα αγαθα διδοναι τοισ τεκνοισ υμων ποσω μαλλον ο πατηρ υμων ο εν τοισ ουρανοισ δωσει αγαθα τοισ αιτουσιν αυτον
Matt,183,Matt 7:12,False,False,False,False,False,0,23,23,παντα ουν οσα εαν θελητε ινα ποιωσιν υμιν οι ανθρωποι ουτωσ και υμεισ ποιειτε αυτοισ ουτοσ γαρ εστιν ο νομοσ και οι προφηται
